symbol,company_name,date,headline,summary,source,sentiment_score,sentiment_label,source_api
AAPL,Apple Inc.,2026-01-18T14:00:55Z,Edge-to-Edge Displays: How the iPhone 18 Pro is Changing the Game,"Apple is preparing to introduce a fantastic evolution in smartphone design with its highly anticipated iPhone 18 Pro models. These devices are expected to feature under-display Face ID technology and eliminate the dynamic island, marking the most significant …",Geeky Gadgets,0.9999986886978149,positive,NewsAPI
ADSK,"Autodesk, Inc.",2026-01-17T17:46:30Z,Autodesk (ADSK) Earns Top Pick Status at Piper Sandler on AI Progress,"Autodesk, Inc. (NASDAQ:ADSK) is one of the Hot AI Stocks to Keep on Your Radar. On January 13, Piper Sandler analyst Clarke Jeffries reiterated an Overweight...",Yahoo Entertainment,0.9999929666519165,positive,NewsAPI
ADBE,Adobe Inc.,2026-01-18T09:56:00Z,‘We want to compete for all honours’ – Spurs boss Ho keen for FA Cup success,Tottenham Hotspur head coach Martin Ho says that his side want to compete strongly in the Adobe Women’s FA Cup this season and he will therefore be fielding a strong XI against Leicester City this a...,Fawslfulltime.co.uk,0.9997978806495667,positive,NewsAPI
AMD,"Advanced Micro Devices, Inc.",2026-01-16T20:05:18Z,Mixed options sentiment in Advanced Micro Devices with shares up 2.02%,"See the rest of the story here.

thefly.com provides the latest financial news as it breaks. Known as a leader in market intelligence, The Fly's real-time, streaming news feed keeps individual investors, professional money managers, active traders, and corpor…",Thefly.com,0.9239816069602966,positive,NewsAPI
AMZN,"Amazon.com, Inc.",2026-01-18T14:06:32Z,"Need a reliable monitor that's garnered over 10,000 positive reviews on Amazon? — Then this 'limited time deal' portable monitor that's 34% off will do the trick","We have discovered a lucrative 34% discount for the KYYPortableMonitor(15.6-inch,1080p,FHD,USB-C), a popular, best-selling PC accessory on Amazon that's been lavished with over 10,000 positive reviews.",Windows Central,0.9998989105224609,positive,NewsAPI
AMZN,"Amazon.com, Inc.",2026-01-18T14:00:34Z,Big savings: Get up to 65% off plant-based protein powders at Amazon Great Republic Day Sale for daily nutrition support,"Stock up on plant-based protein powders at lower prices during the Amazon sale to support daily nutrition, strength, and fitness goals. | Health",Hindustan Times,0.9991580247879028,positive,NewsAPI
APP,AppLovin Corporation,2026-01-17T11:45:32Z,Morgan Stanley Lifts AppLovin Corporation (APP) Target on AI-Led Growth Thesis,"AppLovin Corporation (NASDAQ:APP) is among the stocks with the best earnings growth for the next 5 years. On January 13, Morgan Stanley lifted the price...",Yahoo Entertainment,1.0,positive,NewsAPI
APP,AppLovin Corporation,2026-01-14T13:03:19Z,"Here Are Wednesday’s Top Wall Street Analyst Research Calls: AppLovin, Blackrock, Citigroup, DoorDash, Fabrinet, KLA Corp, Okta, Rivian, Uber and More","Pre-Market Stock Futures: Futures are trading lower after the January rally hit a wall on Wednesday, with all major indices falling, and the selling looks...",24/7 Wall St.,-0.9887250065803528,negative,NewsAPI
APP,AppLovin Corporation,2026-01-14T11:03:51Z,"AppLovin initiated with bullish view at Evercore ISI, here's why","See the rest of the story here.

thefly.com provides the latest financial news as it breaks. Known as a leader in market intelligence, The Fly's real-time, streaming news feed keeps individual investors, professional money managers, active traders, and corpor…",Thefly.com,0.9895646572113037,positive,NewsAPI
APP,AppLovin Corporation,2026-01-12T13:00:04Z,Applovin call buyer realizes 20% same-day gains,"See the rest of the story here.

thefly.com provides the latest financial news as it breaks. Known as a leader in market intelligence, The Fly's real-time, streaming news feed keeps individual investors, professional money managers, active traders, and corpor…",Thefly.com,0.9659193754196167,positive,NewsAPI
APP,AppLovin Corporation,2026-01-10T08:14:22Z,"Benchmark Names AppLovin (APP) a 2026 Top Idea, Reiterates Buy","AppLovin Corporation (NASDAQ:APP) is one of the AI Stocks Analysts Are Watching Closely. On January 6, Benchmark analyst Mike Hickey reiterated a Buy rating ...",Yahoo Entertainment,0.9999998807907104,positive,NewsAPI
APP,AppLovin Corporation,2026-01-09T17:05:01Z,Applovin call volume above normal and directionally bullish,"See the rest of the story here.

thefly.com provides the latest financial news as it breaks. Known as a leader in market intelligence, The Fly's real-time, streaming news feed keeps individual investors, professional money managers, active traders, and corpor…",Thefly.com,0.9935882091522217,positive,NewsAPI
APP,AppLovin Corporation,2026-01-09T15:55:34Z,Benchmark Co Reiterates a Buy Rating on AppLovin Corporation (APP),"AppLovin Corporation (NASDAQ:APP) is one of the Best Unstoppable Growth Stocks to Buy Right Now. On January 6, Mike Hickey from Benchmark Co. reiterated a...",Yahoo Entertainment,0.9999996423721313,positive,NewsAPI
ARM,Arm Holdings plc,2026-01-18T13:39:47Z,'A clear penalty' or a 'ridiculous' claim?,"The Forest right-back attempted to control a bouncing ball in his own penalty area while being challenged by Gabriel Jesus and bumped by his own team-mate Elliot Anderson. The ball hit Aina's shoulder before striking his arm as the defender tried to turn, pro…",Yahoo Entertainment,-0.7843397855758667,negative,NewsAPI
AVGO,Broadcom Inc.,2026-01-18T12:30:59Z,Top Wall Street analysts are confident about these three stocks for the long term,"TipRanks highlights three stocks, including Broadcom and Meta Platforms, favored by Wall Street pros.",CNBC,0.9997416138648987,positive,NewsAPI
AVGO,Broadcom Inc.,2026-01-17T11:45:23Z,"Wells Fargo Turns Bullish on Broadcom Inc. (AVGO), Citing Stronger 2026 Catalysts","Broadcom Inc. (NASDAQ:AVGO) is among the stocks with the best earnings growth for the next 5 years. On January 15, Wells Fargo upgraded its rating on...",Yahoo Entertainment,1.0,positive,NewsAPI
AVGO,Broadcom Inc.,2026-01-16T19:17:07Z,Broadcom Issues $4.5B in Notes as AI Concerns Linger,"Broadcom Inc. (NASDAQ:AVGO) is among the most profitable US stocks to buy. On January 12, Broadcom Inc. (NASDAQ:AVGO) announced the issuance of $4.5 billion ...",Yahoo Entertainment,0.9999988079071045,positive,NewsAPI
BIIB,Biogen Inc.,2026-01-13T18:00:00Z,"Systemic Lupus Erythematosus Market to Exhibit Growth at a CAGR of 9.4% During the Forecast Period (2025–2034) Owing to Rising Use of Biologics – Approvals of BENLYSTA and SAPHNELO, Plus a Strong Pipeline | DelveInsight","The total market size of systemic lupus erythematosus is expected to increase in the 7MM during the forecast period, driven by ongoing clinical research of therapies such as nipocalimab (Johnson & Johnson), Litifilimab (Biogen and Royalty Pharma), Ianalumab (…",GlobeNewswire,0.999998927116394,positive,NewsAPI
BIIB,Biogen Inc.,2026-01-13T16:45:00Z,"JPM26: Biotech’s M&A lift, the ‘new’ Biogen and Merck’s $70B target","Venture investors are adopting a more aggressive mindset heading into 2026, while Merck, Moderna and Summit are all approaching crucial trial readouts.",Biopharmadive.com,0.9999855756759644,positive,NewsAPI
BIIB,Biogen Inc.,2026-01-13T08:02:39Z,"Biogen CEO Says New Drugs Offset MS Decline, Eyes 2026 “Transformational Era” at JPMorgan Conference",Biogen (NASDAQ:BIIB) CEO Chris Viehbacher told investors the company has worked to stabilize its business as its multiple sclerosis (MS) portfolio continues ...,MarketBeat,0.9987123012542725,positive,NewsAPI
BIIB,Biogen Inc.,2026-01-12T16:08:19Z,Biogen announces EU approval for high dose regimen of Spinraza for SMA,"See the rest of the story here.

thefly.com provides the latest financial news as it breaks. Known as a leader in market intelligence, The Fly's real-time, streaming news feed keeps individual investors, professional money managers, active traders, and corpor…",Thefly.com,0.8587028384208679,positive,NewsAPI
BIIB,Biogen Inc.,2026-01-12T16:05:00Z,Biogen Receives European Commission Approval for High Dose Regimen of SPINRAZA® (nusinersen) for Spinal Muscular Atrophy,"CAMBRIDGE, Mass., Jan. 12, 2026 (GLOBE NEWSWIRE) -- Biogen Inc. (Nasdaq: BIIB) today announced the European Commission (EC) has granted marketing authorization for a high dose regimen of SPINRAZA® (nusinersen) which is comprised of 50 mg/5 mL and 28 mg/5 mL d…",GlobeNewswire,0.9718565344810486,positive,NewsAPI
CRWD,"CrowdStrike Holdings, Inc.",2026-01-14T22:13:08Z,CrowdStrike shareholders lose battle to recoup losses from 2024 outage,"Investors didn't present a valid claim, says judge, but they're welcome to try again A group of CrowdStrike shareholders who sued the company over losses sustained following its 2024 global outage will have to head back to the drawing board if they hope to re…",Theregister.com,-0.9845139384269714,negative,NewsAPI
CRWD,"CrowdStrike Holdings, Inc.",2026-01-14T20:10:53Z,CrowdStrike defeats shareholder lawsuit over huge software outage,Which crashed more than 8 million Windows computers worldwide.,iTnews,-0.9443823099136353,negative,NewsAPI
CRWD,"CrowdStrike Holdings, Inc.",2026-01-14T16:09:30Z,CrowdStrike Defeats Shareholder Lawsuit Over Huge Software Outage,"A federal judge dismissed a lawsuit by CrowdStrike shareholders who said the cybersecurity company defrauded them by concealing its inadequate software testing and quality assurance procedures, before a July 2024 outage crashed more than 8 million Microsoft W…",Insurance Journal,-0.9910913109779358,negative,NewsAPI
CRWD,"CrowdStrike Holdings, Inc.",2026-01-14T15:52:46Z,CrowdStrike defeats shareholder lawsuit over huge software outage,"Jan 14 : A federal judge dismissed a lawsuit by CrowdStrike shareholders who said the cybersecurity company defrauded them by concealing its inadequate software testing and quality assurance procedures, before a July 2024 outage crashed more than 8 million Mi…",CNA,-0.9198932647705078,negative,NewsAPI
CRWD,"CrowdStrike Holdings, Inc.",2026-01-14T15:51:30Z,CrowdStrike defeats shareholder lawsuit over huge software outage,A federal judge dismissed a lawsuit by CrowdStrike shareholders who said the cybersecurity company defrauded them by concealing its inadequate ​software...,Yahoo Entertainment,-0.7843729853630066,negative,NewsAPI
CRWD,"CrowdStrike Holdings, Inc.",2026-01-14T14:31:00Z,Texas judge throws out second lawsuit over CrowdStrike outage,A US judge has dismissed a lawsuit filed by CrowdStrike shareholders over the July 2024 outage that caused widespread disruption around the world.,ComputerWeekly.com,-0.9311636090278625,negative,NewsAPI
CRM,"Salesforce, Inc.",2026-01-17T11:45:27Z,"Wolfe Research Sees Strong AI Momentum at Salesforce, Inc. (CRM)","Salesforce, Inc. (NYSE:CRM) is among the stocks with the best earnings growth for the next 5 years. On January 15, Wolfe Research maintained an ‘Outperform’ ...",Yahoo Entertainment,1.0,positive,NewsAPI
CRWV,"CoreWeave, Inc.",2026-01-16T20:37:32Z,Mixed options sentiment in CoreWeave Inc with shares up 7.02%,"See the rest of the story here.

thefly.com provides the latest financial news as it breaks. Known as a leader in market intelligence, The Fly's real-time, streaming news feed keeps individual investors, professional money managers, active traders, and corpor…",Thefly.com,0.9464958310127258,positive,NewsAPI
CRWV,"CoreWeave, Inc.",2026-01-14T21:44:00Z,"CoreWeave, Inc. (CRWV) Slapped With Securities Class Action Amid Questions Over Denton Data Center Completion Transparency, $14 Billion Market Cap Loss - Hagens Berman",Investors who lost money in CRWV after its stock plunged 34% due to allegedly misleading financial statements are urged to contact Hagens Berman....,GlobeNewswire,-0.9997355341911316,negative,NewsAPI
CVLT,"Commvault Systems, Inc.",2026-01-16T19:10:49Z,Commvault Systems (CVLT) Remains a Strong Buy,"Commvault Systems, Inc. (NASDAQ:CVLT) is one of the 15 software stocks with the highest upside potential. On January 12, KeyBanc cut its price target on...",Yahoo Entertainment,0.9997987151145935,positive,NewsAPI
CVX,Chevron,2026-01-16T10:50:17Z,"Stock Market Today: Dow Jones, S&P 500 Futures Gain Following Stellar Chipmaker Rally—Chevron, Paysafe, J.B. Hunt Transport In Focus","U.S. stock futures rose on Friday following Thursday’s positive close. Futures of major benchmark indices were higher.
On Thursday, chip stocks were standout performers after Taiwan Semiconductor Manufacturing Co. (NYSE:TSM) posted a record quarter. Financial…",Biztoc.com,0.9999998807907104,positive,NewsAPI
DASH,"DoorDash, Inc.",2026-01-18T10:11:02Z,"I quit my $390K tech job to start my own business. I still question my decision, but this is the first time in years I've woken up excited for life.",Shiyao Tang quit her $390K job at DoorDash to build a silk womenswear brand. Five months of careful planning helped her exit her corporate job.,Business Insider,0.8672309517860413,positive,NewsAPI
DASH,"DoorDash, Inc.",2026-01-17T12:03:00Z,"Like DoorDash and Google’s CEOs, $7.6 billion Informatica boss is a McKinsey alum—he says being ‘pushed around’ by smart consultants helped him grow","The CEO of Informatica, Amit Walia, says he encountered imposter syndrome and critiques at the consulting giant. And McKinsey has proved itself as a training hotbed for future leaders, creating more Fortune 500 CEOs than anywhere else.",Fortune,0.9860251545906067,positive,NewsAPI
DDOG,"Datadog, Inc.",2026-01-15T13:15:15Z,"Why Analysts Are Closely Watching Datadog, Inc. (DDOG)","Datadog, Inc. (NASDAQ:DDOG) is among the most promising growth stocks according to analysts. On January 12, Eric Heath from KeyBanc maintained an ‘Overweight...",Yahoo Entertainment,0.9999996423721313,positive,NewsAPI
FLEX,Flex Ltd.,2026-01-14T08:26:29Z,"Executive Centre India gets Sebi nod for ₹2,600 crore IPO to invest in subsidiaries, expand operations","The Executive Centre India Ltd plans to raise  ₹2,600 crore through an IPO to expand its operations and acquire subsidiaries. The flexible workspace sector in India is witnessing strong demand, with companies increasingly adopting flexible office solutions as…",Livemint,0.9999934434890747,positive,NewsAPI
GOOGL,Alphabet Inc.,2026-01-17T17:52:44Z,Alphabet (GOOGL) Gets $350 Target From Truist as Search Momentum Holds,"Alphabet Inc. (NASDAQ:GOOGL) is one of the Hot AI Stocks to Keep on Your Radar. On January 13, Truist Securities analyst Youssef Squali reiterated a Buy...",Yahoo Entertainment,0.9999955892562866,positive,NewsAPI
GTLB,GitLab Inc.,2026-01-16T13:36:33Z,GitLab Duo Agent Platform solves the AI paradox in software delivery,"GitLab announced the GitLab Duo Agent Platform, delivering agentic AI that enables teams to orchestrate agents across the entire software lifecycle. AI tools have been improving developers’ ability to write code, and in some cases, developers are reporting 10…",Help Net Security,0.9999997615814209,positive,NewsAPI
HAL,Halliburton Company,2026-01-15T17:30:00Z,Halliburton Looking Forward To A Swift Return To Venezuela,"Oilfield services company Haliburton (NYSE:HAL) says it expects to make a quick return to Venezuela, with company CEO Jeff Miller saying the company could be active in the South American country in a matter of months. Halliburton aims to help rebuild the nati…",OilPrice.com,0.7962937355041504,positive,NewsAPI
HAL,Halliburton Company,2026-01-14T11:40:01Z,"Halliburton price target raised by $1 at Piper Sandler, here's why","See the rest of the story here.

thefly.com provides the latest financial news as it breaks. Known as a leader in market intelligence, The Fly's real-time, streaming news feed keeps individual investors, professional money managers, active traders, and corpor…",Thefly.com,0.7778410911560059,positive,NewsAPI
HIMS,"Hims & Hers Health, Inc.",2026-01-12T19:00:47Z,Bullish flow in Hims and Hers Health with shares up 0.41%,"See the rest of the story here.

thefly.com provides the latest financial news as it breaks. Known as a leader in market intelligence, The Fly's real-time, streaming news feed keeps individual investors, professional money managers, active traders, and corpor…",Thefly.com,0.9999957084655762,positive,NewsAPI
HOOD,"Robinhood Markets, Inc.",2026-01-16T21:44:38Z,Robinhood Crypto Offers a Seamless Trading Experience,Robinhood brings crypto trading to everyday investors.,Robb Report,0.9973010420799255,positive,NewsAPI
HOOD,"Robinhood Markets, Inc.",2026-01-16T19:31:13Z,Robinhood CEO Vlad Tenev Expresses Frustration Over 'Legislative Gridlock' As Crypto Market Structure Bill Gets Delayed Again,"Robinhood Markets Inc. (NASDAQ:HOOD) CEO Vlad Tenev on Wednesday urged the U.S. to take the lead on cryptocurrency policy, citing the unavailability of...",Yahoo Entertainment,-0.9999302625656128,negative,NewsAPI
INTC,Intel Corporation,2026-01-17T19:26:00Z,"Slim and compact mini PC from MSI boasts up to a 20-core CPU, 64 GB of DDR5 RAM, and an impressive selection of ports","The MSI PRO DP10 A14MG mini PC is the latest from the brand, featuring an impressive array of ports and options for both affordable and powerful Intel CPUs. The mini PC is decently compact as well, sizing in at just over a litre in volume.",Notebookcheck.net,1.0,positive,NewsAPI
KLAC,KLA Corporation,2026-01-17T17:57:39Z,KLA (KLAC) Gets Upgrade as Foundry-Led WFE Demand Accelerates,"KLA Corporation (NASDAQ:KLAC) is one of the Trending AI Stocks on Wall Street. On January 13, TD Cowen analyst Krish Sankar upgraded the stock from Hold to “...",Yahoo Entertainment,0.9999746084213257,positive,NewsAPI
KLAC,KLA Corporation,2026-01-15T16:39:56Z,What Do Analysts Think About KLA Corporation (KLAC)?,KLA Corporation (NASDAQ:KLAC) is one of the best long term growth stocks to buy according to hedge funds. KLA Corporation (NASDAQ:KLAC) received a rating...,Yahoo Entertainment,1.0,positive,NewsAPI
KLAC,KLA Corporation,2026-01-14T13:03:19Z,"Here Are Wednesday’s Top Wall Street Analyst Research Calls: AppLovin, Blackrock, Citigroup, DoorDash, Fabrinet, KLA Corp, Okta, Rivian, Uber and More","Pre-Market Stock Futures: Futures are trading lower after the January rally hit a wall on Wednesday, with all major indices falling, and the selling looks...",24/7 Wall St.,-0.9887250065803528,negative,NewsAPI
KLAC,KLA Corporation,2026-01-13T21:16:44Z,"KLA Corp. initiated with bullish view at Bernstein, here's why","See the rest of the story here.

thefly.com provides the latest financial news as it breaks. Known as a leader in market intelligence, The Fly's real-time, streaming news feed keeps individual investors, professional money managers, active traders, and corpor…",Thefly.com,0.9676555395126343,positive,NewsAPI
KLAC,KLA Corporation,2026-01-13T13:00:24Z,"Here Are Tuesday’s Top Wall Street Analyst Research Calls: Adobe, AMD, Disney, Five Below, Intel, Reddit, KLA Corp, PayPal, Super Micro Computer and More","Pre-Market Stock Futures: The futures are trending higher after the December consumer price index came in at 2.7%, which matched Wall Street expectations...",24/7 Wall St.,0.9842157959938049,positive,NewsAPI
KLAC,KLA Corporation,2026-01-12T01:26:06Z,"India roundup: India's OSATs are comfortable with materials today, but that may not last","India's backend semiconductor makers see temporary relief from material constraints linked to legacy packaging, as KLA opens a US$36 million R&D hub in Chennai to boost AI, software, and process control capabilities.",Digitimes,0.9999704360961914,positive,NewsAPI
LRCX,Lam Research Corporation,2026-01-18T05:55:06Z,Analysts Bullish on Lam Research Corporation (LRCX) as Semiconductor Capex and Memory Investments Rise,We recently compiled a list of the 10 Best Investments During A Recession. The fourth stock on our list of best investments is Lam Research Corporation...,Yahoo Entertainment,0.9999982118606567,positive,NewsAPI
LRCX,Lam Research Corporation,2026-01-14T21:26:10Z,"Lam Research initiated with bullish view at RBC Capital, here's why","See the rest of the story here.

thefly.com provides the latest financial news as it breaks. Known as a leader in market intelligence, The Fly's real-time, streaming news feed keeps individual investors, professional money managers, active traders, and corpor…",Thefly.com,0.9773812294006348,positive,NewsAPI
META,"Meta Platforms, Inc.",2026-01-18T12:30:59Z,Top Wall Street analysts are confident about these three stocks for the long term,"TipRanks highlights three stocks, including Broadcom and Meta Platforms, favored by Wall Street pros.",CNBC,0.9997416138648987,positive,NewsAPI
META,"Meta Platforms, Inc.",2026-01-18T12:18:00Z,Storm Chasers Sue Meta for Ignoring Repeat Infringements of Popular Accounts,"For independent creators documenting the world's most extreme weather, the real disaster isn't the storm; it's the aftermath on social media. A coalition of professional storm chasers has sued Meta for systematic copyright infringement. The complaint alleges …",Torrentfreak.com,-0.9646397829055786,negative,NewsAPI
MRVL,"Marvell Technology, Inc.",2026-01-15T16:20:02Z,Celebrating Excellence: The 2026 Fortinet Customer Excellence Award Winners,"Introducing the 2026 Fortinet Customer Award winners, global leaders in cybersecurity transformation, OT security, and SASE innovation. Learn how Marvell Technologies, Wendy’s, and others are driving real-world outcomes with Fortinet.",Fortinet.com,0.9999717473983765,positive,NewsAPI
MRVL,"Marvell Technology, Inc.",2026-01-10T08:04:00Z,Marvell (MRVL) Gets Strong Buy as Raymond James Backs XConn Acquisition,"Marvell Technology, Inc. (NASDAQ:MRVL) is one of the AI Stocks Analysts Are Watching Closely. On January 6, Raymond James analyst Simon Leopold reiterated a ...",Yahoo Entertainment,0.9999998807907104,positive,NewsAPI
MSFT,Microsoft Corporation,2026-01-18T13:12:05Z,Microsoft forced to issue emergency out of band updates for Windows 11 after latest security patches broke PC shutdowns and sign-ins,The latest OS updates for Windows 11 introduces two major bugs that caused issues with shutting down your PC or signing into your PC using Remote Desktop.,Windows Central,-0.9997596144676208,negative,NewsAPI
MSFT,Microsoft Corporation,2026-01-18T08:59:37Z,fastmssql 0.6.0,A high-performance async Python library for Microsoft SQL Server built on Rust for heavy workloads and low latency.,Pypi.org,0.8210863471031189,positive,NewsAPI
MU,"Micron Technology, Inc.",2026-01-18T14:21:39Z,"Micron Makes a Bold Bet to Expand Memory Production, Striking a Massive Fab Acquisition Deal With Taiwan’s Powerchip to Combat Shortages","Micron, a prominent memory manufacturer, has decided to accelerate DRAM production by collaborating with Powerchip, one of Taiwan's largest suppliers. Micron's New Strategic Partnership With PSMC Could Scale DRAM Output By Up To 15% In a Few Quarters When it …",Wccftech,0.999562680721283,positive,NewsAPI
MU,"Micron Technology, Inc.",2026-01-18T10:48:14Z,Micron to buy Taiwan chip fabrication site for $1.8 billion,"Micron Technology plans to buy a Taiwanese fabrication site from Powerchip Semiconductor Manufacturing for $1.8 billion to boost chip production. The Tongluo site will gradually increase DRAM production, with major volumes expected by 2027, alongside a partne…",The Times of India,0.9860868453979492,positive,NewsAPI
MU,"Micron Technology, Inc.",2026-01-17T00:00:01Z,Here's why Jim Cramer thinks chip stocks can go higher,"As shares of Micron headed higher on Friday, CNBC's Jim Cramer explained why he thinks chip stocks still have room to run.",CNBC,0.9999583959579468,positive,NewsAPI
MU,"Micron Technology, Inc.",2026-01-16T21:11:39Z,Micron breaks ground on humungous NY DRAM fab after beating bats and tree huggers,"Chipmaker claims the four-fab site could expand US-based DRAM production by a factor of 12 Micron broke snowy winter ground in New York on Friday to begin building a chip fab that promises to bring up to 50,000 jobs and much-needed computer memory production …",Theregister.com,0.9844416975975037,positive,NewsAPI
MU,"Micron Technology, Inc.",2026-01-16T15:31:44Z,Micron stock price today: What's driving MU rally - $100 billion New York mega fab site and insider share purchase,"Micron stock price: Micron Technology's stock surged over 6% after announcing a monumental $100 billion memory manufacturing complex in New York. This facility, slated to be the largest in the U.S. and begin production in 2030, is expected to create 50,000 jo…",The Times of India,0.9999855756759644,positive,NewsAPI
MU,"Micron Technology, Inc.",2026-01-15T20:00:00Z,"After Micron's 200%+ Surge, This AI Chip Stock Could Be Next","NVIDIA could be the next big AI chip winner as Micron's rally fades, with soaring data center demand and strong uptake for Blackwell and H200 chips.",Yahoo Entertainment,1.0,positive,NewsAPI
NBIS,Nebius Group,2026-01-09T19:49:08Z,Mixed options sentiment in Nebius Group NV with shares up 2.26%,"See the rest of the story here.

thefly.com provides the latest financial news as it breaks. Known as a leader in market intelligence, The Fly's real-time, streaming news feed keeps individual investors, professional money managers, active traders, and corpor…",Thefly.com,0.9322183728218079,positive,NewsAPI
NET,"Cloudflare, Inc.",2026-01-17T16:30:20Z,"Cloudflare Tunnels are great, but you should never use them for media streaming",Use the right tools for the job.,XDA Developers,0.9022385478019714,positive,NewsAPI
