symbol,company_name,date,headline,summary,source,sentiment_score,sentiment_label,source_api
ADSK,"Autodesk, Inc.",2026-02-26T23:25:04Z,Autodesk tops estimates in fourth quarter as billings surge 33% year-over-year,Shares in Autodesk Inc. rose more than 5% in late trading today after the computer-aided design company reported earnings and revenue ahead of expectations in its fiscal 2026 fourth quarter and also provided stronger-than-expected guidance for its fiscal year…,SiliconANGLE News,1.0,positive,NewsAPI
ADSK,"Autodesk, Inc.",2026-02-22T17:09:36Z,Autodesk (ADSK) Invests $200 Million in World Labs,"​Autodesk, Inc. (NASDAQ:ADSK) is one of the Most Promising Stocks to Invest In Before They Take Off. On February 19, Reuters reported that World Labs...",Yahoo Entertainment,0.9959671497344971,positive,NewsAPI
ADBE,Adobe Inc.,2026-02-26T16:37:04Z,'Caught in that tricky middle ground': Adobe highlights widening gap between consumers and businesses using agentic AI,Agentic AI roll-outs aren't going well for businesses - but consumer attitudes may surprise you.,TechRadar,-0.9965410828590393,negative,NewsAPI
AFRM,"Affirm Holdings, Inc.",2026-02-26T11:14:00Z,"Buy Now Pay Later Platforms Market Report 2026, Profiles of Afterpay, Klarna, Affirm, Zip, Sezzle, PayPal, Splitit, Perpay, Navalo, FuturePay - Trends, Opportunities, and Forecasts to 2031",The Buy Now Pay Later (BNPL) market capitalizes on the rapid growth of digital commerce and the preference of Millennials and Gen Z for flexible payment options. Opportunities lie in expanding BNPL into high-value sectors like travel and integrating installme…,GlobeNewswire,0.9999958276748657,positive,NewsAPI
AMD,"Advanced Micro Devices, Inc.",2026-02-26T17:34:39Z,Advanced Micro Devices (AMD) Stock Experiences Pullback Amid Broader Market Pressures,"Advanced Micro Devices Inc. (NASDAQ: AMD) shares fell sharply in late February trading, dipping below $203 amid broader semiconductor sector volatility and investor digestion of recent gains tied to artificial intelligence demand.",Ibtimes.com.au,-0.9999929666519165,negative,NewsAPI
AMD,"Advanced Micro Devices, Inc.",2026-02-26T03:35:08Z,The looming Taiwan chip disaster that Silicon Valley has long ignored,"In secret briefings held in Washington and Silicon Valley, national security officials warned executives from companies like Apple, Advanced Micro Devices and Qualcomm that China was making plans to retake Taiwan, which Beijing has long considered a breakaway…",The Times of India,-0.9999915361404419,negative,NewsAPI
AMZN,"Amazon.com, Inc.",2026-02-27T04:36:45Z,Duracell 40x AAA or AA $15.99 @ Costco (Membership Required),"I know there's some negative reviews on these but, 40 batteries for 15.99 seemed really good compared to getting the amazon basics ones that don't last at all. Duracell has worked for me …",Ozbargain.com.au,0.9999909400939941,positive,NewsAPI
AMZN,"Amazon.com, Inc.",2026-02-27T03:49:22Z,Dell expects AI server revenue to double in fiscal 2027 on data center boom,"The company ⁠announced a ⁠20% hike in its cash dividend and an additional $10 billion for its share repurchase program. Big tech firms, such as Alphabet, Microsoft, Amazon, and Meta, ​are expected to spend at least $630 billion to build AI infrastructure this…",The Times of India,0.9999938011169434,positive,NewsAPI
APP,AppLovin Corporation,2026-02-26T02:05:16Z,Analysts Remain Bullish on AppLovin Corporation (APP) Despite Target Cuts,"AppLovin Corporation (NASDAQ:APP) is among the best stocks in each sector in 2026. On February 12, Omar Dessouky from BofA reduced the price target on...",Yahoo Entertainment,0.9999747276306152,positive,NewsAPI
APP,AppLovin Corporation,2026-02-20T20:19:11Z,"SEC probe involving AppLovin still active, Bloomberg News reports","Feb 20 : The U.S. Securities and Exchange Commission's investigation into marketing platform AppLovin is continuing, Bloomberg News reported on Friday.Bloomberg had in October reported that the SEC was probing allegations that AppLovin violated platform partn…",CNA,-0.8830845952033997,negative,NewsAPI
APP,AppLovin Corporation,2026-02-19T05:01:44Z,Analysts Bullish On AppLovin Corporation (APP) Outlook Following Impressive Results,"AppLovin Corporation (NASDAQ:APP) is among the best money-making stocks to buy right now. On February 12, Michael Pachter, an analyst at Wedbush, lifted the ...",Yahoo Entertainment,1.0,positive,NewsAPI
ARM,Arm Holdings plc,2026-02-27T04:51:06Z,Can a man defeat a chimp?,"Can a Man Defeat a Chimp? The Brutal Reality The answer to the question Can a man defeat a chimp? is, overwhelmingly, no, not in a fair, unarmed fight. Chimpanzees possess incredible strength and agility, making them a formidable opponent. The Stark Reality o…",Lifesciencesworld.com,0.9999194145202637,positive,NewsAPI
ARM,Arm Holdings plc,2026-02-27T01:59:24Z,"12 stocks to watch on Friday: Select PSUs, Jio Financial, HCL Tech in focus","Jio Financial infused ₹2,000 crore into its lending arm, IT and AI partnerships gained traction, Hindalco’s US deal faced delays, Brigade entered senior housing, energy firms secured fresh orders, and key PSUs announced expansion moves.",BusinessLine,0.9573834538459778,positive,NewsAPI
AXON,"Axon Enterprise, Inc.",2026-02-25T17:00:07Z,Axon shares soar 20% after upbeat earnings as AI demand accelerates,"Axon's growth underscores the transformative impact of AI on business models, highlighting potential shifts in industry standards and competition.
The post Axon shares soar 20% after upbeat earnings as AI demand accelerates appeared first on Crypto Briefing.",Crypto Briefing,1.0,positive,NewsAPI
AXON,"Axon Enterprise, Inc.",2026-02-25T14:23:16Z,Axon Surges 16% as Blockbuster Bookings and AI Growth Silence the Bears,Axon Enterprise (NASDAQ: AXON) is surging roughly 19% in premarket trading this morning after the company posted a strong Q4 beat Tuesday evening. Yesterday ...,24/7 Wall St.,0.9999998807907104,positive,NewsAPI
AXON,"Axon Enterprise, Inc.",2026-02-25T13:18:10Z,Axon shares rise as Taser-maker's profit gets boost from government spending,"Feb 25 : Axon Enterprise shares jumped 16 per cent in premarket trading on Wednesday after the Taser-maker reported fourth‑quarter profit above Wall Street expectations, on strong demand for its security devices and software products.Increased federal investm…",CNA,1.0,positive,NewsAPI
AXON,"Axon Enterprise, Inc.",2026-02-23T12:48:18Z,Do Wall Street Analysts Like Axon Enterprise Stock?,"Axon Enterprise has markedly lagged the broader market over the past year, but analysts remain strongly bullish on the stock’s outlook.",Barchart.com,1.0,positive,NewsAPI
BKR,Baker Hughes Company,2026-02-20T18:13:00Z,US Oil Drilling Activity Still Going Nowhere,"The total number of active drilling rigs for oil and gas in the United States stayed the same this week, according to new data that Baker Hughes published on Friday, keeping the total rig count in the US  at 551 this week, down 41 from this same time last yea…",OilPrice.com,-0.9823910593986511,negative,NewsAPI
CDNS,"Cadence Design Systems, Inc.",2026-02-26T15:02:16Z,Jim Cramer Highlights the Strength of Cadence Design,"Cadence Design Systems, Inc. (NASDAQ:CDNS) is one of the stocks that was on Jim Cramer’s radar recently. Cramer discussed the stock during the episode and...",Yahoo Entertainment,0.9999974966049194,positive,NewsAPI
COIN,"Coinbase Global, Inc.",2026-02-26T04:00:14Z,Bitcoin Flips To A Premium On Coinbase As US Institutions Absorb Global Retail Panic – Details,"Bitcoin is struggling to push decisively above the $66,000 level as persistent selling pressure continues to weigh on sentiment across the crypto market. Price action remains fragile, with bears maintaining short-term control while buyers show limited convict…",Bitcoinist,-0.999998927116394,negative,NewsAPI
COIN,"Coinbase Global, Inc.",2026-02-25T21:34:16Z,Coinbase Was Among the S&P 500's Biggest Gainers Wednesday. Here's Why.,"Shares of Coinbase Global, the crypto-turned-everything exchange, are surging following its stock trading rollout in the U.S. and a recovery in bitcoin...",Investopedia,0.9199264645576477,positive,NewsAPI
COIN,"Coinbase Global, Inc.",2026-02-25T17:48:23Z,The UK is picking winners for its digital dollar future while Coinbase CEO cries foul,"Coinciding with the FCA’s announcement of its stablecoin trial, Coinbase’s Brian Armstrong criticized the U.K.’s regulatory process, saying it puts the region's global crypto leadership at risk.",CoinDesk,-0.9991080164909363,negative,NewsAPI
CRWV,"CoreWeave, Inc.",2026-02-27T00:28:12Z,CoreWeave’s stock drops on mixed results and plans to scale up AI spending,"Shares of the cloud infrastructure company CoreWeave Inc. fell more than 9% in late trading today after it posted a bigger-than-expected loss per share and offered a weak revenue forecast for the current quarter. The company, which is laser-focused on the art…",SiliconANGLE News,-0.9999982118606567,negative,NewsAPI
CRWV,"CoreWeave, Inc.",2026-02-26T21:55:00Z,"CoreWeave reports Q4 revenue up 110% YoY to $1.57B, vs. $1.55B est., and adjusted loss of $284M, vs. $258.9M est.; CRWV drops 5%+ after hours (Reuters)","Reuters:
CoreWeave reports Q4 revenue up 110% YoY to $1.57B, vs. $1.55B est., and adjusted loss of $284M, vs. $258.9M est.; CRWV drops 5%+ after hours  —  CoreWeave (CRWV.O) beat Wall Street estimates for quarterly revenue on Thursday, benefiting from the art…",Techmeme.com,1.0,positive,NewsAPI
CRWV,"CoreWeave, Inc.",2026-02-26T21:20:41Z,CoreWeave beats revenue projections as backlog swells to nearly $67 billion,"CoreWeave is now sitting on a backlog of nearly $67 billion in revenue, with business from Meta and OpenAI.",CNBC,0.9999992847442627,positive,NewsAPI
CRWV,"CoreWeave, Inc.",2026-02-26T21:10:36Z,"CoreWeave slides as surging capex, backlog risks overshadow small revenue beat","Feb 26 : CoreWeave forecast that its capital expenses for the year will double, as it spends heavily to scale up its AI cloud platform to handle the massive computing power demanded by its customers to train and deploy advanced AI models.Its shares slumped 10…",CNA,-0.9998691082000732,negative,NewsAPI
CRWV,"CoreWeave, Inc.",2026-02-26T21:10:36Z,CoreWeave beats fourth-quarter revenue estimates,"Feb 26 : CoreWeave beat Wall Street estimates for quarterly revenue on Thursday, benefiting from the artificial intelligence boom that has driven companies to its platform for the massive computing power needed to train and deploy advanced AI models.However, …",CNA,1.0,positive,NewsAPI
CVLT,"Commvault Systems, Inc.",2026-02-26T13:31:56Z,"Commvault Systems, Inc. (CVLT) Has Healthy Upside According To Analysts","Commvault Systems, Inc. (NASDAQ:CVLT) is one of the 10 best beaten down software stocks with the highest upside potential. According to CNN’s analyst ratings...",Yahoo Entertainment,1.0,positive,NewsAPI
CVX,Chevron,2026-02-27T00:41:53Z,Oil sales under US-Venezuela deal expected to reach $2 billion by end of February,"U.S. oil supply agreement sales with Venezuela are projected to hit $2 billion by month's end, with 40 million barrels expected to be sold. Trading houses Vitol and Trafigura are marketing the oil, while partners like Chevron boost output. The crude and fuel …",The Times of India,0.9733371734619141,positive,NewsAPI
CVX,Chevron,2026-02-26T09:12:00Z,"Refined Petroleum Products Industry Report 2026-2035: A $3.89 Trillion Market by 2030 with Saudi Aramco, Exxon Mobil, Chevron, Valero Energy Corp, Marathon Petroleum, and Total SA Leading","The refined petroleum products market presents opportunities driven by increasing transportation fuel demands, refining capacity expansion, and urbanization. Key growth drivers include the demand for low sulfur fuels, refinery modernization, cleaner fuel adop…",GlobeNewswire,0.9999961853027344,positive,NewsAPI
CVX,Chevron,2026-02-26T09:11:00Z,"Aviation Gasoline Industry Report 2026-2035: A $2.58 Billion Market by 2030 with Shell, BP, ExxonMobil, TotalEnergies, and Chevron Leading","Opportunities in the aviation gasoline market include growth in general and recreational aviation, modernization of fleets, demand for sustainable fuels, and expansion of regional airports. Rising small aircraft usage and SAF innovations present further poten…",GlobeNewswire,0.9998769760131836,positive,NewsAPI
CVX,Chevron,2026-02-26T09:08:00Z,"Aviation Fuel Industry Report 2026-2035: A $499.86 Billion Market by 2030 with BP, Chevron, Exxon Mobil, PJSC Gazprom, and Indian Oil Leading","The aviation fuel market is poised for growth driven by increasing air travel, fleet expansions, and rising military spending. Opportunities lie in sustainable aviation fuel innovation, supply chain resilience, and expanding infrastructure, with North America…",GlobeNewswire,0.9999998807907104,positive,NewsAPI
CVX,Chevron,2026-02-26T09:04:00Z,"Gasoline Industry Report 2026-2035: A $1.85 Trillion Market by 2030 with Exxon Mobil, Shell, Chevron, and PBF Energy Leading","Key market opportunities in the gasoline sector include growth from increased vehicle ownership, developing economies, and small engine applications. Trends like fuel efficiency improvements, additive-blended fuel demand, and rising geopolitical tensions pres…",GlobeNewswire,0.9999967813491821,positive,NewsAPI
DDOG,"Datadog, Inc.",2026-02-25T22:00:00Z,Datadog and Sakana AI Announce Strategic Partnership to Advance AI Innovation and Observability for Enterprises,Datadog and Sakana AI collaboration brings together leading AI research and cloud observability expertise to support next-generation AI applications....,GlobeNewswire,0.9995607733726501,positive,NewsAPI
ENPH,"Enphase Energy, Inc.",2026-02-24T12:10:00Z,"INVESTOR ALERT: Enphase Energy, Inc. Investors with Substantial Losses Have Opportunity to Lead the Class Action Lawsuit – RGRD Law",The case alleges Enphase Energy misled investors about channel inventory and its ability to mitigate the 25D tax credit’s termination....,GlobeNewswire,-0.9974043965339661,negative,NewsAPI
ENPH,"Enphase Energy, Inc.",2026-02-20T16:30:44Z,Enphase Energy (ENPH) – Among the Energy Stocks that Lost This Week,"The share price of Enphase Energy, Inc. (NASDAQ:ENPH) fell by 4.54% between February 11 and February 18, 2026, putting it among the Energy Stocks that Lost...",Yahoo Entertainment,-0.8199847340583801,negative,NewsAPI
FTNT,"Fortinet, Inc.",2026-02-24T16:00:00Z,Fortinet Achieves IEC 62443-4-1 ML2 Certification for Secure Product Development,"Fortinet has achieved IEC 62443-4-1 Maturity Level 2 certification, validating its Secure Product Development Lifecycle and reinforcing trust for IACS, OT, and critical infrastructure customers.…",Fortinet.com,0.9999995231628418,positive,NewsAPI
GOOGL,Alphabet Inc.,2026-02-27T03:49:22Z,Dell expects AI server revenue to double in fiscal 2027 on data center boom,"The company ⁠announced a ⁠20% hike in its cash dividend and an additional $10 billion for its share repurchase program. Big tech firms, such as Alphabet, Microsoft, Amazon, and Meta, ​are expected to spend at least $630 billion to build AI infrastructure this…",The Times of India,0.9999938011169434,positive,NewsAPI
GOOGL,Alphabet Inc.,2026-02-27T00:00:00Z,"Research Scientist (Machine Learning), London London","Research Scientist, Machine Learning, London Isomorphic Labs is a new Alphabet company that is reimagining drug discovery through a computational- and AI-first approach. We are on a mission to accelerate the speed, increase the efficacy and lower the cost of …",Nlppeople.com,0.9742624163627625,positive,NewsAPI
GOOGL,Alphabet Inc.,2026-02-26T23:58:23Z,Alphabet Integrates Intrinsic with Google: Gemini AI May Power Next-Gen Robots,"Alphabet is integrating Intrinsic with Google, with Gemini AI potentially becoming the brain for next-gen industrial and physical robots.",Android Headlines,0.9753164649009705,positive,NewsAPI
HIMS,"Hims & Hers Health, Inc.",2026-02-24T15:42:26Z,Hims & Hers Health (HIMS) Stock Plunges 7-9% to Near $14 After Soft Q1 2026 Guidance Despite Q4 Beat,"Hims & Hers Health Inc. (NYSE: HIMS) shares tumbled sharply in trading on Tuesday, February 24, 2026, falling as much as 9%",Ibtimes.com.au,-0.999998927116394,negative,NewsAPI
HIMS,"Hims & Hers Health, Inc.",2026-02-24T14:24:03Z,Hims & Hers Stumbles at the Open as Regulatory Damage Hits 2026 Outlook Hard,"Shares of Hims & Hers Health (NYSE:HIMS) are trading lower this morning after yesterday’s earnings, and the reason is straightforward: guidance. Yesterday we...",24/7 Wall St.,-0.9999841451644897,negative,NewsAPI
HIMS,"Hims & Hers Health, Inc.",2026-02-21T15:03:00Z,Hims & Hers in Free Fall: Why Analysts See Nearly 150% Upside,"HIMS is down 48% in the past month following a Novo Nordisk lawsuit. But, analysts expect record revenue when the company reports earnings this month.",MarketBeat,0.9999998807907104,positive,NewsAPI
HIMS,"Hims & Hers Health, Inc.",2026-02-19T13:13:00Z,Hims & Hers continues global expansion with $1.15B acquisition,"Hims & Hers is acquiring Eucalyptus, which operates digital health clinics in Australia, Japan and Europe, giving the U.S. telehealth company access to new markets.",Techtarget.com,0.7938881516456604,positive,NewsAPI
HIMS,"Hims & Hers Health, Inc.",2026-02-18T13:00:00Z,Why the FDA is cracking down on compound GLP-1 drugs for weight loss,The recent withdrawal of Hims & Hers’ GLP-1 pill raises questions about the safety and effectiveness of compounded medications,Scientific American,-0.9999951124191284,negative,NewsAPI
INTC,Intel Corporation,2026-02-27T03:04:01Z,"ASML says next-gen EUV tools ready to mass-produce chips, marking key shift for AI chip production","The Dutch company produces the world's only commercial extreme ultraviolet lithography (EUV) tools, which are a critical ‌piece of equipment ⁠for ⁠chipmakers. This new tool will help chipmakers such as Taiwan Semiconductor Manufacturing and Intel produce more…",The Times of India,0.9511945843696594,positive,NewsAPI
INTC,Intel Corporation,2026-02-26T21:10:10Z,"Microsoft Rolls Out Shader Model 6.9, DXR 1.2 & DX12 Enhancements In Agility SDK 1.619, NVIDIA With Widest Support","Microsoft has just rolled out its Agility SDK 1.619 with major DX12 improvements such as Shader Model 6.9 & DXR 1.2. Microsoft Agility SDK Adds Shader Model 6.9, DXR 1.2, & Various DX12 Improvements: NVIDIA RTX, AMD Radeon & Intel Arc GPUs Ready In the latest…",Wccftech,0.999854326248169,positive,NewsAPI
INTU,Intuit Inc.,2026-02-26T23:50:01Z,"Intuit reports Q2 revenue up 17% YoY to $4.65B, vs. $4.53B est., and forecasts Q3 revenue growth of ~10% and EPS below expectations; INTU drops 5%+ after hours (Kelly Cloonan/Wall Street Journal)","Kelly Cloonan / Wall Street Journal:
Intuit reports Q2 revenue up 17% YoY to $4.65B, vs. $4.53B est., and forecasts Q3 revenue growth of ~10% and EPS below expectations; INTU drops 5%+ after hours  —  The company's profit guidance for its third quarter - whic…",Techmeme.com,-0.9999994039535522,negative,NewsAPI
INTU,Intuit Inc.,2026-02-26T21:04:39Z,Intuit expects profit below estimates on higher marketing spend during US tax season,"Feb 26 : Intuit forecast third-quarter profit below Wall Street estimates on Thursday, as it anticipates higher marketing spending to attract more customers during the U.S. tax season.Shares of the company fell around 3 per cent in extended trading.The third …",CNA,-0.9999997615814209,negative,NewsAPI
INTU,Intuit Inc.,2026-02-26T21:02:58Z,Intuit expects profit below estimates on higher marketing spend during US tax season,"Intuit forecast third-quarter profit below Wall Street estimates on Thursday, as it anticipates higher marketing spending to ‌attract more customers during...",Yahoo Entertainment,-0.9999996423721313,negative,NewsAPI
INTU,Intuit Inc.,2026-02-26T11:45:49Z,How Is Intuit's Stock Performance Compared to Other Software Application Stocks?,"Despite Intuit’s weak performance relative to its peers over the past year, Wall Street analysts remain moderately optimistic about the stock’s prospects",Barchart.com,0.9999191761016846,positive,NewsAPI
INTU,Intuit Inc.,2026-02-26T00:05:14Z,Wix.com (WIX) and Intuit Partnership to Accelerate AI Integration Across Finance and Website Tools,Wix.com Ltd. (NASDAQ:WIX) is one of the 12 Best Beaten Down Technology Stocks to Buy According to Wall Street Analysts. Intuit Inc. (NASDAQ:INTU) and Wix.com...,Yahoo Entertainment,0.999595582485199,positive,NewsAPI
IONQ,"IonQ, Inc.",2026-02-26T18:32:41Z,IonQ Stock Jumps 21% After Earnings Beat. 2026 Revenue Outlook Tops Forecasts. - Barron's,"IonQ Stock Jumps 21% After Earnings Beat. 2026 Revenue Outlook Tops Forecasts.Barron's IonQ Achieves $130.0 Million of GAAP Revenues, Beating Guidance by 20%IonQ Quantum Computing IonQ Earnings Beat, Guidance Above Views. Quantum Firm Targets Q4 2026 Mileston…",Slashdot.org,1.0,positive,NewsAPI
IONQ,"IonQ, Inc.",2026-02-26T03:32:42Z,"Quantum Computing Stocks: IonQ Earnings, Revenue Beat Amid Acquisitions - Investor's Business Daily","Quantum Computing Stocks: IonQ Earnings, Revenue Beat Amid AcquisitionsInvestor's Business Daily IonQ Stock Jumps After Earnings Beat. 2026 Revenue Outlook Tops Expectations.Barron's IonQ Achieves $130.0 Million of GAAP Revenues, Beating Guidance by 20%IonQ Q…",Slashdot.org,1.0,positive,NewsAPI
IONQ,"IonQ, Inc.",2026-02-25T15:41:58Z,IonQ Just Won a Golden Dome Contract. Should You Buy the Quantum Computing Stock Now?,"IonQ’s Golden Dome contract eligibility boosts its defense profile, but lofty valuations keep the quantum stock a high-risk, high-reward bet.",Barchart.com,1.0,positive,NewsAPI
IONQ,"IonQ, Inc.",2026-02-20T16:11:44Z,"Dear IonQ Stock Fans, Mark Your Calendars for February 25",Weakness in this quantum computing stock is a buy opportunity.,Barchart.com,0.9999997615814209,positive,NewsAPI
IT,"Gartner, Inc.",2026-02-27T00:08:09Z,"Memory Price Hikes Will Kill Off Budget PCs and Smartphones, Analyst Warns","Ballooning memory prices are forecast to kill off entry-level PCs, leading to a decline in global shipments this year — and a similar effect is going to hit smartphones. Analyst biz Gartner is projecting a drop in PC shipments of more than 10 percent during 2…",Slashdot.org,-0.9999982118606567,negative,NewsAPI
IT,"Gartner, Inc.",2026-02-26T20:49:22Z,Smartphone Makers Brace for 'Largest Decline Ever' Amid Memory Crunch,"IDC predicts an eye-popping 12.9% drop in smartphone shipments for 2026 and suggests the average selling price could reach a record $523. Gartner has a similarly gloomy outlook.
The memory shortage is so serious that smartphone shipments are projected to expe…",PCMag.com,-0.9999936819076538,negative,NewsAPI
IT,"Gartner, Inc.",2026-02-26T16:15:39Z,"Memory costs to cut PC, smartphone shipments in 2026: Gartner",Gartner forecasts significant declines in PC and smartphone shipments in 2026 due to rising memory costs and increased device prices.,BusinessLine,-0.9999908208847046,negative,NewsAPI
IT,"Gartner, Inc.",2026-02-26T10:17:00Z,Gartner: Memory price hikes set to hit PC market growth,Analyst forecast links expected surge in DRAM and SSD costs to a likely decline in hardware shipments,ComputerWeekly.com,-0.9999473094940186,negative,NewsAPI
JOBY,"Joby Aviation, Inc.",2026-02-26T10:26:00Z,"Advanced Air Mobility Research Report 2026-2035: A $29.68 Billion Market by 2030 with Boeing, Airbus, Honeywell International, Bell Textron, Bristow Group and Joby Aviation Leading","Key market opportunities in advanced air mobility include addressing urban congestion, adoption of electric propulsion, autonomous navigation development, and integration with air traffic management. Growth fueled by urbanization and traffic issues, with Nort…",GlobeNewswire,0.9957026839256287,positive,NewsAPI
JOBY,"Joby Aviation, Inc.",2026-02-26T10:04:00Z,"Zero-Emission Aircraft Research Report 2026-2035: A $56+ Billion Market by 2030 with Boeing, AeroDelft, Wright Electric, Airbus, Bye Aerospace, ZeroAvia, Eviation Aircraft, Joby Aviation Leading","Key market opportunities in the zero-emission aircraft sector include rising adoption of hydrogen and battery-electric propulsion, increased regulatory pressures for emission reduction, expansion of green infrastructure, and collaboration between aerospace an…",GlobeNewswire,0.9996854066848755,positive,NewsAPI
LRCX,Lam Research Corporation,2026-02-24T07:39:00Z,"Plug the leaks permanently to restore public trust, says social activist","PETALING JAYA: The recurring loss of millions of ringgit in public funds due to leakages is not just financial wastage but a serious breach of trust that deprives the rakyat of essential services, says Tan Sri Lee Lam Thye. Read full story",The Star Online,-0.9796847105026245,negative,NewsAPI
LRCX,Lam Research Corporation,2026-02-23T19:51:11Z,Lam Research (LRCX) Expands Footprint Amid Industry Momentum,"Lam Research Corporation (NASDAQ:LRCX) is one of Goldman Sachs’s top growth stock picks. On February 17, Lam Research Corporation (NASDAQ:LRCX) opened a new ...",Yahoo Entertainment,0.9999279975891113,positive,NewsAPI
MCK,McKesson Corporation,2026-02-25T15:30:01Z,"Barclays Boosts McKesson (MCK) Price Target, Says Shares Likely to Stay in Favor","McKesson Corporation (NYSE:MCK) is included among the Goldman Sachs Dividend Stocks: Top 14 Stock Picks. On February 18, Barclays raised its price objective ...",Yahoo Entertainment,0.9999982118606567,positive,NewsAPI
