symbol,company_name,date,headline,summary,source,sentiment_score,sentiment_label,source_api
KVYO,"Klaviyo, Inc.",2026-02-24 16:30:09,Klaviyo Stock Jumps After Google Partnership Announcement,Klaviyo Inc (NYSE:KVYO) shares are trading higher on Tuesday. The B2C CRM platform announced a major strategic partnership with Google.,Benzinga,0.9999939203262329,positive,Finnhub
KVYO,"Klaviyo, Inc.",2026-02-24 13:01:56,"Klaviyo Partners With Google To Deliver AI-Driven Autonomous Customer Experiences From Product Discovery Through Purchase, Service And Loyalty","Partnership brings together Google&#39;s leadership in search and discovery with Klaviyo&#39;s B2C CRM to turn customer intent into lasting relationshipsKlaviyo (NYSE:KVYO), the autonomous B2C CRM, today announced a strategic",Benzinga,0.9999608993530273,positive,Finnhub
LRCX,Lam Research Corporation,2026-02-27 10:22:35,LAM RESEARCH CORP (NASDAQ:LRCX) Embodies the Minervini Trend Template with Strong Fundamental Momentum,"Lam Research exemplifies a high-growth momentum stock, meeting strict technical trend and accelerating fundamental earnings criteria for potential leadership.",ChartMill,1.0,positive,Finnhub
LRCX,Lam Research Corporation,2026-02-26 21:59:33,"Applied Materials, Broadcom, Lam Research, Western Digital, and Allegro MicroSystems Shares Are Falling, What You Need To Know","A number of stocks fell in the afternoon session after the semiconductor sector tumbled as a 'buy the rumor, sell the news' event unfolded around AI-chip leader Nvidia, despite its strong earnings report.",Yahoo,-0.9992461204528809,negative,Finnhub
LRCX,Lam Research Corporation,2026-02-26 16:33:00,Lam Research Corp. stock underperforms Thursday when compared to competitors,Lam Research Corp. stock underperforms Thursday when compared to competitors,MarketWatch,0.7986331582069397,positive,Finnhub
LRCX,Lam Research Corporation,2026-02-26 05:12:50,Lam Research Resets Technology Path With CEA Leti Deal And Boise Bet,"Lam Research announced a new partnership with research institute CEA-Leti focused on next generation specialty semiconductor technology. The company is reshaping its leadership team alongside this technology collaboration. Lam is expanding its US footprint with a new facility in Boise, Idaho, centered on advanced memory chip manufacturing near key customer Micron. These moves come as Lam Research (NasdaqGS: LRCX) trades at $249.48, with the stock up 3.9% over the past week and 11.9% over...",Yahoo,0.8314339518547058,positive,Finnhub
LRCX,Lam Research Corporation,2026-02-25 16:33:00,Lam Research Corp. stock outperforms competitors on strong trading day,Lam Research Corp. stock outperforms competitors on strong trading day,MarketWatch,0.9999960660934448,positive,Finnhub
LRCX,Lam Research Corporation,2026-02-25 13:08:00,Can Foundry Strength Keep Lam Research's $5B+ Revenue Streak Alive?,LRCX's AI-driven foundry surge pushes revenues past $5B for a third straight quarter. Can the Systems segment's growth keep the streak alive?,Yahoo,0.9999998807907104,positive,Finnhub
LRCX,Lam Research Corporation,2026-02-24 23:01:00,"Top Stock Reports for Costco, Roche & Lam Research","Costco's resilient membership model, strong cash flow and e-commerce momentum position it to weather market turmoil and keep earnings growing.",Yahoo,0.9999998807907104,positive,Finnhub
LRCX,Lam Research Corporation,2026-02-24 12:50:00,LRCX vs. ASML: Which Semiconductor Equipment Giant Is the Better Buy?,"Lam Research edges ahead of ASML Holding with stronger growth forecasts, solid AI-driven demand and a more attractive valuation in the chip equipment race.",Yahoo,1.0,positive,Finnhub
LRCX,Lam Research Corporation,2026-02-23 21:09:32,Assessing Lam Research (LRCX) Valuation After Strong Recent Share Price Momentum,"Lam Research (LRCX) has attracted fresh attention after recent share price moves, with the stock showing gains over the past week, month, and past 3 months that stand out among semiconductor equipment peers. See our latest analysis for Lam Research. At the latest share price of $244.92, Lam Research has logged a 12.38% 1 month share price return and a 32.35% year to date share price return, alongside a very large 1 year total shareholder return. Taken together, these figures point to strong...",Yahoo,1.0,positive,Finnhub
LRCX,Lam Research Corporation,2026-02-23 16:32:00,Lam Research Corp. stock outperforms competitors despite losses on the day,Lam Research Corp. stock outperforms competitors despite losses on the day,MarketWatch,0.9999902248382568,positive,Finnhub
LRCX,Lam Research Corporation,2026-02-23 13:30:04,"If You Invested $1000 in Lam Research a Decade Ago, This is How Much It'd Be Worth Now","Why investing for the long run, especially if you buy certain popular stocks, could reap huge rewards.",Yahoo,0.9999996423721313,positive,Finnhub
LRCX,Lam Research Corporation,2026-02-20 17:45:01,3 Reasons Growth Investors Will Love Lam Research (LRCX),Lam Research (LRCX) could produce exceptional returns because of its solid growth attributes.,Yahoo,1.0,positive,Finnhub
LRCX,Lam Research Corporation,2026-02-20 14:07:51,Lam Research Named Top Semiconductor Pick As AI-Driven Manufacturing Supercycle Shifts Into High Gear,"BofA Securities analyst Vivek Arya has named Lam Research (LRCX) his top pick in the semiconductor equipment sector, citing a projected $135 billion industry spending surge for 2026. As AI-driven demand for advanced memory and logic chips outstrips current factory capacity, Lam is positioned to lead a multi-year manufacturing boom that could extend well into 2027.",Benzinga,0.9999997615814209,positive,Finnhub
LRCX,Lam Research Corporation,2026-02-20 00:28:11,Is Lam Research (LRCX) One of the Best Growth Stocks to Buy for the Next 20 Years?,"Lam Research Corporation (NASDAQ:LRCX) is one of the best growth stocks to buy for the next 20 years. Earlier on January 29, TD Cowen raised its price target on Lam Research to $290 from $170 while keeping a Buy rating. The firm identified the 2026 Wafer Fabrication Equipment/WFE outlook of $135 billion as a major […]",Yahoo,1.0,positive,Finnhub
LRCX,Lam Research Corporation,2026-02-19 19:08:14,Lam Research Boise Expansion Deepens Micron Ties In AI Memory Cycle,"Lam Research opened a new office in Boise to work more closely with Micron Technology on R&D and manufacturing for advanced memory chips. The expansion supports Micron's DRAM production for AI focused applications and reflects Lam's role in front end equipment for memory fabrication. Micron recently recognized Lam Research as an Outstanding Front End Equipment Supplier, highlighting the depth of the partnership. For investors tracking NasdaqGS:LRCX, this Boise expansion comes as the stock...",Yahoo,0.9957022070884705,positive,Finnhub
LRCX,Lam Research Corporation,2026-02-19 10:51:08,Lam Research Corp (NASDAQ:LRCX) Shows Strong Growth Momentum and Technical Setup,"Lam Research (LRCX) combines strong earnings growth, positive analyst revisions, and a powerful technical uptrend, presenting a high-growth momentum opportunity.",ChartMill,1.0,positive,Finnhub
LRCX,Lam Research Corporation,2026-02-18 14:30:04,Is Lam Research (LRCX) a Buy as Wall Street Analysts Look Optimistic?,"According to the average brokerage recommendation (ABR), one should invest in Lam Research (LRCX). It is debatable whether this highly sought-after metric is effective because Wall Street analysts' recommendations tend to be overly optimistic. Would it be worth investing in the stock?",Yahoo,0.9988413453102112,positive,Finnhub
MCK,McKesson Corporation,2026-02-26 23:14:52,A Look At McKesson (MCK) Valuation After Strong Earnings And Growing Analyst Optimism,"Why McKesson (MCK) is Back on Investors’ Radar Recent quarterly results from McKesson (MCK), with revenue and operating profit ahead of expectations, have turned the stock into a focal point for many investors and institutions. See our latest analysis for McKesson. The strong quarter has been accompanied by firm share price momentum, with a 16.8% 1 month share price return and 18.3% year to date. The 1 year total shareholder return of 57.6% highlights how longer term holders have been...",Yahoo,1.0,positive,Finnhub
MCK,McKesson Corporation,2026-02-25 15:30:01,"Barclays Boosts McKesson (MCK) Price Target, Says Shares Likely to Stay in Favor","McKesson Corporation (NYSE:MCK) is included among the Goldman Sachs Dividend Stocks: Top 14 Stock Picks. On February 18, Barclays raised its price objective on McKesson Corporation (NYSE:MCK) to $1,050 from $960. The firm reiterated an Overweight rating on the shares. Analysts said the stock is expected to “remain in favor” as investors look for “pockets […]",Yahoo,0.9999998807907104,positive,Finnhub
MCK,McKesson Corporation,2026-02-25 13:26:23,See How Institutional Inflows Make McKesson Fly,McKesson Corporation (MCK) shares up 58% in a year thanks to Big Money.,Yahoo,0.9999991655349731,positive,Finnhub
MCK,McKesson Corporation,2026-02-24 14:30:06,Wall Street Analysts Think McKesson (MCK) Is a Good Investment: Is It?,"According to the average brokerage recommendation (ABR), one should invest in McKesson (MCK). It is debatable whether this highly sought-after metric is effective because Wall Street analysts' recommendations tend to be overly optimistic. Would it be worth investing in the stock?",Yahoo,0.9564433693885803,positive,Finnhub
MCK,McKesson Corporation,2026-02-24 14:09:11,Faruqi Review Of McKesson Share Plan Puts Dilution And Governance In Focus,"Faruqi & Faruqi, LLP has launched an investigation into McKesson's Board over potential breaches of fiduciary duties. The probe focuses on the Board's recommendation to approve a significant issuance of additional McKesson shares. This proposed share issuance could affect existing shareholders through potential dilution of their ownership stakes. For investors tracking McKesson, NYSE:MCK, this investigation comes at a time when the stock price is $949.25. The company has posted a 57.4%...",Yahoo,-0.700779378414154,negative,Finnhub
MCK,McKesson Corporation,2026-02-24 11:23:00,"Radiology Information System Market Competitive Landscape Report 2025 Featuring Top Players - Koninklijke Philips, Siemens Healthcare, Oracle, McKesson, GE HealthCare","The global Radiology Information Systems (RIS) market is set to expand significantly, projecting an increase from USD 1.16 billion in 2025 to USD 2.17 billion by 2033, fueled by an 8.14% CAGR. Key drivers include advancements in health IT, growing RIS adoption for workflow management, and a surge in demand for precise diagnoses and integrated health systems globally. RIS enhances radiology departments by managing medical images and data, boosting patient management and decision-making efficiency",Yahoo,1.0,positive,Finnhub
MCK,McKesson Corporation,2026-02-23 09:04:00,"Healthcare Workforce Management System Industry Report 2026-2035: A $4.74 Billion Market by 2030 with McKesson, Oracle, ADP, Cerner, and Workday Leading","The healthcare workforce management system market is expanding rapidly, driven by digital HR adoption, AI-driven workforce planning, and cost control needs. Key opportunities include cloud-based platforms, predictive analytics, and automated tools. North America leads with major companies like Oracle and McKesson innovating solutions. Healthcare Workforce Management System Market Healthcare Workforce Management System Market Dublin, Feb. 23, 2026 (GLOBE NEWSWIRE) -- The ""Healthcare Workforce Man",Yahoo,0.9994045495986938,positive,Finnhub
MCK,McKesson Corporation,2026-02-20 10:03:00,"Bundled Pay Management Software Analysis Report 2026-2035: A $7.25+ Billion Market by 2030 with UnitedHealth, McKesson, Oracle, Tata Consultancy Services Leading","The bundled pay management software market sees opportunities in cloud-based solutions, AI-driven payroll automation, and integrated HCM platforms. Demand for real-time compliance, scalability, and AI analytics drives growth. North America leads, with Asia-Pacific as a fast-growing region. Bundled Pay Management Software Market Bundled Pay Management Software Market Dublin, Feb. 20, 2026 (GLOBE NEWSWIRE) -- The ""Bundled Pay Management Software Market Report 2026"" has been added to ResearchAndMar",Yahoo,0.9999996423721313,positive,Finnhub
MCK,McKesson Corporation,2026-02-18 11:40:29,"Barclays Maintains Overweight on McKesson, Raises Price Target to $1050",Barclays  analyst Glen Santangelo   maintains McKesson (NYSE:MCK) with a Overweight and raises the price target from $960 to $1050.,Benzinga,0.9999995231628418,positive,Finnhub
MRK,"Merck & Co., Inc.",2026-02-27 21:07:16,"Merck Stock, Up 18% In 2026, Ticks Another Box. Is It Now A Buy?",Merck stock ticked another box Friday after the firm said its Keytruda-containing regimen improved outcomes for ovarian cancer patients.,Yahoo,0.9999997615814209,positive,Finnhub
MRK,"Merck & Co., Inc.",2026-02-27 20:51:18,"Sunrun stock nosedives on outlook, Merck job cuts, Jefferies sinks","Market Domination host Josh Lipton takes a look at some of Friday's trending tickers and stories. Merck (MRK) announced it will cut staff from one of its HPV vaccine factories. Jefferies (JEF) stock is falling on the company's exposure to a failed finance firm, another blow to the private credit market. Sunrun (RUN) stock is nosediving after the company's cautious outlook disappointed investors. To watch more expert insights and analysis on the latest market action, check out more Market Domination.",Yahoo,-0.8832354545593262,negative,Finnhub
MRK,"Merck & Co., Inc.",2026-02-27 17:28:54,"Merck Stock, Up 13% In 2026, Ticks Another Box. Is It Now A Buy?",Merck stock ticked another box Friday after the firm said its Keytruda-containing regimen improved outcomes for ovarian cancer patients.,Yahoo,0.9999997615814209,positive,Finnhub
MRK,"Merck & Co., Inc.",2026-02-27 15:15:00,KEYTRUDA® (pembrolizumab) Plus Paclitaxel With or Without Bevacizumab Significantly Improved Key Secondary Endpoint of Overall Survival (OS) Versus Paclitaxel With or Without Bevacizumab in Patients With Platinum-Resistant Recurrent Ovarian Cancer,"RAHWAY, N.J., February 27, 2026--Merck (NYSE: MRK), known as MSD outside of the United States and Canada, today announced results from the final analysis of the pivotal Phase 3 KEYNOTE-B96 trial, also known as ENGOT-ov65, showing that KEYTRUDA® (pembrolizumab), Merck’s anti-PD-1 therapy, in combination with chemotherapy (paclitaxel) with or without bevacizumab significantly improved overall survival (OS), a key secondary endpoint, for patients with platinum-resistant recurrent ovarian cancer reg",Yahoo,0.9996055960655212,positive,Finnhub
MRK,"Merck & Co., Inc.",2026-02-27 15:00:00,KEYTRUDA® (pembrolizumab) Plus Padcev® (enfortumab vedotin-ejfv) Reduced Risk of Event-Free Survival Events by 47% and Risk of Death by 35% for Cisplatin-Eligible Patients with Muscle-Invasive Bladder Cancer When Given Before and After Surgery,"RAHWAY, N.J., February 27, 2026--Merck (NYSE: MRK), known as MSD outside of the United States and Canada, today announced KEYTRUDA® (pembrolizumab) plus Padcev ® (enfortumab vedotin-ejfv) reduced the risk of event-free survival (EFS) events by 47% and reduced the risk of death by 35% when given before and after surgery versus neoadjuvant chemotherapy and surgery in patients with muscle-invasive bladder cancer (MIBC) who are eligible for cisplatin-based chemotherapy. These late-breaking data will",Yahoo,0.9732270836830139,positive,Finnhub
MRK,"Merck & Co., Inc.",2026-02-26 18:25:07,Merck Stock Jumps But Reddit Traders Are Getting Cold Feet,"A giant in the healthcare space, Merck (NYSE:MRK) shares are up 13.5% year-to-date and trading near $119.47, yet retail sentiment on Reddit has slipped from a bullish 63 over the past quarter to a neutral 43 this week. The catalyst is Merck’s February 23 announcement to split its Human Health business into two divisions: one ... Merck Stock Jumps But Reddit Traders Are Getting Cold Feet",Yahoo,0.9994004964828491,positive,Finnhub
MRK,"Merck & Co., Inc.",2026-02-26 02:48:02,RBC Capital Sees Merck (MRK) Returning to Growth Sooner Than Market Expects,"Merck & Co., Inc. (NYSE:MRK) is included among the 14 Best Affordable Dividend Stocks to Buy According to Analysts. On February 25, RBC Capital initiated coverage of Merck & Co., Inc. (NYSE:MRK) with an Outperform rating and a $142 price target. The firm believes investor interest in the stock could continue, supported by upcoming product […]",Yahoo,1.0,positive,Finnhub
MRK,"Merck & Co., Inc.",2026-02-25 22:09:37,Merck Reshapes Leadership As HIV And RSV Prospects Take Center Stage,"Merck (NYSE:MRK) announced a major reorganization of its Human Health business into two global units focused on Oncology and on Specialty, Pharma & Infectious Diseases. The company named new senior leaders to run these units, reshaping internal decision making and commercial execution. Merck reported pivotal late stage data for a new two drug HIV-1 regimen that met its non inferiority goal versus standard of care and is now under regulatory review. The company also released positive phase 3...",Yahoo,0.9999841451644897,positive,Finnhub
MRK,"Merck & Co., Inc.",2026-02-25 21:30:00,FDA Approves NUMELVI™ (atinvicitinib tablets) for Dogs from Merck Animal Health – The First and Only Second-Generation Janus Kinase (JAK) Inhibitor for the Control of Pruritus Associated with Allergic Dermatitis,"RAHWAY, N.J., February 25, 2026--Merck Animal Health, known as MSD Animal Health outside of the United States and Canada, a division of Merck & Co., Inc., Rahway, N.J., USA (NYSE:MRK), announced today the U.S. Food and Drug Administration (FDA) approval of NUMELVI™ (atinvicitinib tablets) – the first and only second-generation Janus kinase (JAK) inhibitor indicated for the control of pruritus associated with allergic dermatitis in dogs six months of age and older. The product is expected to be a",Yahoo,0.9823629856109619,positive,Finnhub
MRK,"Merck & Co., Inc.",2026-02-25 17:38:00,Merck’s New HIV Drug Shows Promise. Its Chief Medical Officer Explains Why Wall Street Should Care.,Merck’s two-drug HIV regimen matched Gilead’s blockbuster Biktarvy in Phase 3 trials and is under FDA review as the company prepares for Keytruda’s patent cliff.,Yahoo,0.9999912977218628,positive,Finnhub
MRK,"Merck & Co., Inc.",2026-02-25 17:35:00,Merck Animal Health Receives FDA Approval For Canine Medication For Pruritis Associated With Allergic Dermatitis,The product is expected to be available at veterinary clinics and hospitals nationwide in spring 2026.,Benzinga,0.9969260096549988,positive,Finnhub
MRK,"Merck & Co., Inc.",2026-02-25 09:43:04,GSK to acquire 35Pharma in $950M deal for cardiovascular drug,The deal hands GSK a drug it views as a potentially “best-in-class” therapy for blood pressure diseases like pulmonary arterial hypertension — the target of Merck’s fast-selling Winrevair.,Yahoo,0.9998601675033569,positive,Finnhub
MRK,"Merck & Co., Inc.",2026-02-25 09:10:00,"Merck & Co Digital Transformation Strategy Analysis Report 2025: Accelerators, Innovation Programs, Incubators, ICT, Technology Initiatives, Partnerships, Investments, Acquisitions, Network Map","Merck's market opportunities lie in its broad biopharmaceutical offerings, targeting oncology, vaccines, and more, alongside extensive veterinary solutions. Its tech-driven innovations, strategic partnerships, and global presence enhance its competitive edge in healthcare and digital transformation initiatives.Dublin, Feb. 25, 2026 (GLOBE NEWSWIRE) -- The ""Enterprise Tech Ecosystem Series: Merck & Co., Inc. 2025"" company profile has been added to ResearchAndMarkets.com's offering. The report pro",Yahoo,0.9999982118606567,positive,Finnhub
MRK,"Merck & Co., Inc.",2026-02-25 08:35:33,"RBC Capital Initiates Coverage On Merck & Co with Outperform Rating, Announces Price Target of $142",RBC Capital   initiates coverage on Merck &amp; Co (NYSE:MRK) with a Outperform rating and announces Price Target of $142.,Benzinga,1.0,positive,Finnhub
MRK,"Merck & Co., Inc.",2026-02-24 16:04:23,How Is Merck & Co.'s Stock Performance Compared to Other Healthcare Stocks?,"Despite Merck & Co.’s strong performance relative to its peers over the past year, Wall Street analysts remain cautiously optimistic about the stock’s prospects",Yahoo,0.9991998076438904,positive,Finnhub
MRK,"Merck & Co., Inc.",2026-02-24 09:26:03,"Amazon, Merck, PG&E And More On CNBC's 'Final Trades'","Amazon invests $12 billion in data centers in Louisiana, Merck &amp; Co., Inc. receives positive coverage, and Horizon Kinetics Inflation Beneficiaries ETF shows slight growth.",Benzinga,0.9999998807907104,positive,Finnhub
MRK,"Merck & Co., Inc.",2026-02-24 07:11:14,Merck (MRK) Announces Positive Phase 3 SMART Trial Results for ENFLONSIA (Clesrovimab),"Merck & Co. Inc. (NYSE:MRK) is one of the best value stocks to buy now. On February 19, Merck announced positive second-season findings from the Phase 3 SMART trial evaluating ENFLONSIA (clesrovimab) in infants and children under 2 years of age at increased risk for severe respiratory syncytial virus/RSV. The data focused on vulnerable children, […]",Yahoo,1.0,positive,Finnhub
MRK,"Merck & Co., Inc.",2026-02-23 18:12:45,Barclays Highlights Merck’s (MRK) Pipeline Catalysts in Coverage Initiation,"Merck & Co., Inc. (NYSE:MRK) is included among the 14 Best Low Volatility Dividend Stocks to Invest in. On February 20, Barclays started coverage of Merck & Co., Inc. (NYSE:MRK) with an Overweight rating. It set a $140 price target on the stock. The firm said the company’s 2026 will bring “first-in-class” launches and important […]",Yahoo,0.9999934434890747,positive,Finnhub
MRK,"Merck & Co., Inc.",2026-02-23 17:44:22,Novo Next-Generation Obesity Shot Falls Short of Lilly Rival,"Novo Nordisk's next-generation obesity shot delivered less weight loss than Eli Lilly rival blockbuster in yet another blow to the Danish company's attempts to regain lost ground in the weight-loss market. People treated with a standard dose of Novo's CagriSema in a trial achieved 20.2% weight loss after 84 weeks, compared with 23.6% for Lilly's tirzepatide. Sam Fazeli of Bloomberg Intelligence joins to discuss. He also breaks down how Merck is splitting its main pharmaceutical unit in two in an effort to better highlight the parts of the business that are growing, as it stares down a patent cliff for its best-selling cancer drug Keytruda.",Yahoo,0.9955126643180847,positive,Finnhub
MRK,"Merck & Co., Inc.",2026-02-23 13:23:00,Merck reportedly ready to the splits as Keytruda patent cliff looms. Market shrugs,"Investors gave a collective meh to news that Merck & Co Inc (NYSE:MRK, XETRA:6MK) is reportedly restructuring its human-health division, with shares marking time in premarket trading despite a reorganisation that signals the US drugmaker is bracing for the biggest revenue hit in its recent...",Yahoo,-0.6914921998977661,negative,Finnhub
MRK,"Merck & Co., Inc.",2026-02-23 12:45:00,"Merck Revamps Pharmaceutical Unit, Creating Separate Cancer Business",The drugmaker is reorganizing to bolster product launches ahead its cancer drug Keytruda’s patent loss.,Yahoo,-0.6880345940589905,negative,Finnhub
MRK,"Merck & Co., Inc.",2026-02-23 10:16:11,Merck's Strategic Shift Signals New Growth Horizons,Merck restructures its Human Health business as Keytruda faces a 2028 patent loss.,Benzinga,-0.769590437412262,negative,Finnhub
MRK,"Merck & Co., Inc.",2026-02-23 09:09:00,Merck RSV And KEYTRUDA Updates Refocus Attention On Valuation And Growth,"Merck (NYSE:MRK) reported positive Phase 3 SMART trial results for ENFLONSIA, showing protection against RSV in high risk infants during a second RSV season. The findings expand the potential use of ENFLONSIA beyond current approvals for RSV prevention in young children. The FDA also approved new formulations and indications for KEYTRUDA, including the first subcutaneous option and new uses for KEYTRUDA and KEYTRUDA QLEX in certain hard to treat cancers. For you as an investor, this news...",Yahoo,0.999998927116394,positive,Finnhub
MRK,"Merck & Co., Inc.",2026-02-23 08:38:28,"Merck to split cancer, specialty drug businesses in leadership shakeup","Ahead of the looming loss of Keytruda’s exclusivity, the company is creating a standalone, cancer-focused unit and a second business housing its other drugs and vaccines.",Yahoo,0.9564809799194336,positive,Finnhub
MRK,"Merck & Co., Inc.",2026-02-22 16:21:00,Could Merck Stock Quietly Help Turn Steady Dividends Into a Millionaire Retirement?,Merck has an attractive yield and a long history of dividend growth.,Yahoo,1.0,positive,Finnhub
MRK,"Merck & Co., Inc.",2026-02-20 23:31:10,"Deutsche Bank Upgrades Merck (MRK) to Buy, Sees “Clear Path” Beyond Keytruda Patent Cliff","Merck & Co., Inc. (NYSE:MRK) is included among the 16 Best Dividend Stocks with Rising Payouts. On February 13, Deutsche Bank analyst James Shin upgraded Merck & Co., Inc. (NYSE:MRK) to Buy from Hold. The analyst raised his price target on the stock to $150 from $115. In a research note, he said the market […]",Yahoo,0.9999995231628418,positive,Finnhub
MRK,"Merck & Co., Inc.",2026-02-20 17:05:00,Merck vs. Bristol Myers: Which Pharma Stock Is a Better Pick in 2026?,"BMY edges past MRK as generic headwinds bite, but new drug launches, cost cuts and a stronger 2026 outlook tilt the investment case in its favor.",Yahoo,0.9999992847442627,positive,Finnhub
