symbol,company_name,date,headline,summary,source,sentiment_score,sentiment_label,source_api
NFLX,"Netflix, Inc.",2026-01-14 13:13:56,Netflix: An All-Cash Deal For Warner Bros. Will Be A Drag On FY 2026 EPS,"Netflix, Inc. may shift to an all-cash bid for Warner Bros. Discovery, Inc. Click for what this deal may mean to both NFLX and WBD shareholders.",SeekingAlpha,-0.9299798607826233,negative,Finnhub
NFLX,"Netflix, Inc.",2026-01-14 13:12:56,Do You Believe in the Long-Term Growth Potential of Netflix (NFLX)?,"Mar Vista Investment Partners, LLC, an investment management company, released its “Mar Vista U.S. Quality Strategy” fourth-quarter 2025 investor letter. A copy of the letter can be downloaded here. US equities experienced a strong momentum in 2025 and marked their second consecutive year of double-digit gains. The market witnessed one of the fastest recoveries following its […]",Yahoo,1.0,positive,Finnhub
NFLX,"Netflix, Inc.",2026-01-14 10:51:00,"These Stocks Are Today’s Movers: Bank of America, Netflix, Nvidia, Fortinet, Intel, Rivian, and More","Bank of America, Wells Fargo, and Citigroup are set to report earnings Wednesday, a day after JPMorgan Chase posted a decline in quarterly profit.",Yahoo,-0.9998307228088379,negative,Finnhub
NFLX,"Netflix, Inc.",2026-01-13 23:30:55,"Stock Market Today, Jan. 13: Netflix Rises After HSBC Upgrade Sparks Optimism Ahead of Earnings","Today, Jan. 13, 2026, analysts clash over Netflix's content spend, merger ambitions, and what really matters ahead of earnings.",Yahoo,0.9891202449798584,positive,Finnhub
NFLX,"Netflix, Inc.",2026-01-13 21:37:00,"Top Analyst Reports for Netflix, Toyota Motor & Amphenol","NFLX eyes doubling revenue by 2030 as ads drive 55%+ of new sign-ups, free cash flow rises to $9B and Q4 growth stays strong.",Yahoo,1.0,positive,Finnhub
NFLX,"Netflix, Inc.",2026-01-13 17:45:35,Paramount  Sues Warner Bros Over Netflix Deal,Showdown heats up as Paramount pushes to block Netflix's $82.7 billion bid.,Yahoo,-0.8769286274909973,negative,Finnhub
NFLX,"Netflix, Inc.",2026-01-13 15:00:04,Netflix (NFLX) Earnings Expected to Grow: Should You Buy?,Netflix (NFLX) possesses the right combination of the two key ingredients for a likely earnings beat in its upcoming report. Get prepared with the key expectations.,Yahoo,0.9999997615814209,positive,Finnhub
NFLX,"Netflix, Inc.",2026-01-13 12:00:02,Netflix Calendar Spread: A Smart Play on Volatility,Netflix (NFLX) stock has been in a severe downtrend for the best part of three months.,Yahoo,-0.999612033367157,negative,Finnhub
NFLX,"Netflix, Inc.",2026-01-13 12:00:00,Netflix Wanted to Reinvent Live TV. It Hasn’t Been Easy.,"After some very public glitches, Netflix thinks it has cracked the code on the tech needed to stream live events. Executives say it has been harder than anticipated.",Yahoo,-0.9999946355819702,negative,Finnhub
NFLX,"Netflix, Inc.",2026-01-13 09:45:00,Is Netflix Stock a Buy Under $100?,Netflix stock has dropped almost 20% since November.,Yahoo,0.991797685623169,positive,Finnhub
NFLX,"Netflix, Inc.",2026-01-12 18:57:28,"Paramount fires back at Warner Bros. bid, launching proxy fight for board seats at annual meeting",Paramount has also filed a lawsuit asking Warner Bros. Discovery to give more information about its merger agreement with Netflix.,Yahoo,-0.9427213668823242,negative,Finnhub
NFLX,"Netflix, Inc.",2026-01-12 17:47:17,Netflix’s (NFLX) Deal with Warner Bros Remains on Track,"Netflix, Inc. (NASDAQ:NFLX) is one of the Best Stocks to Buy for High Returns in 2026. Netflix’s deal to acquire Warner Bros remains on track. In a recent update, on January 7, Reuters reported that Warner Bros Discovery turned down Paramount Skydance’s latest attempt to acquire the studio. The board of Warner Bros rejected the […]",Yahoo,0.9968302845954895,positive,Finnhub
NFLX,"Netflix, Inc.",2026-01-12 17:06:12,Paramount files lawsuit against Warner Bros. amidst controversial Netflix merger,"Paramount has filed a lawsuit against Warner Bros. Discovery, demanding greater financial disclosure regarding Netflix's $82.7 billion acquisition.",Yahoo,-0.9894812107086182,negative,Finnhub
NFLX,"Netflix, Inc.",2026-01-12 16:45:07,"As Netflix Drops 33%, Is NFLX Stock Buy Ahead of Q4 Earnings?",Netflix's stock has lost substantial value ahead of the Q4 earnings release. The stock has declined despite the solid underlying business performance.,Yahoo,-0.9996132254600525,negative,Finnhub
NFLX,"Netflix, Inc.",2026-01-12 16:41:00,Netflix vs. Disney: Which Streaming Giant Has an Edge Right Now?,"NFLX touts strong revenue growth, ad-tier momentum and subscriber gains, but faces margin pressure and a premium valuation in a fierce streaming showdown.",Yahoo,0.9999960660934448,positive,Finnhub
NFLX,"Netflix, Inc.",2026-01-12 14:49:44,Netflix gets HSBC Buy rating as analyst highlights ’sturdy’ earnings outlook,"Investing.com -- HSBC has initiated coverage of Netflix with a Buy rating and a $107 target price, arguing that the recent pullback in the shares presents an opportunity for investors.",Yahoo,1.0,positive,Finnhub
NFLX,"Netflix, Inc.",2026-01-12 13:44:00,"Buy Struggling Netflix Stock, Says Analyst. Why Warner Takeover Fears Are Overblown.","Savvy investors should see a recent selloff as a buying opportunity, HSBC analyst Mohammed Khallouf said.",Yahoo,0.9951561689376831,positive,Finnhub
NFLX,"Netflix, Inc.",2026-01-12 11:28:09,Trump Flags Netflix--Warner Bros. Deal as Antitrust Risk,President Donald Trump reposts criticism urging regulators to scrutinize Netflix's $83B bid for Warner Bros. Discovery assets.,Yahoo,-0.9999749660491943,negative,Finnhub
NFLX,"Netflix, Inc.",2026-01-11 14:30:02,Netflix Stock Is Beaten Down - But Short Put Plays Are Attractive,"Netflix stock has taken a beating, down 27.9% from a peak in late October 2025. Investors aren't too keen on its proposed acquisition of Warner Bros. Discovery. However, one way to play it is to short out-of-the-money (OTM) put options.",Yahoo,0.9755649566650391,positive,Finnhub
NFLX,"Netflix, Inc.",2026-01-10 12:49:18,What Makes Netflix Inc. (NFLX) Attractive,"Netflix Inc. (NASDAQ:NFLX) is one of the best communication services stocks according to Hedge Funds. On December 17, James Heaney of Jefferies reiterated his optimism on Netflix, Inc. (NASDAQ:NFLX). Heaney assigned a Buy rating to the stock with a target price of $134. As per the analyst’s forecast, investors should expect an upside of almost […]",Yahoo,1.0,positive,Finnhub
NFLX,"Netflix, Inc.",2026-01-10 06:33:49,Netflix: What If Netflix Never Buys Warner?,"Netflix (NFLX) is rated a buy as ads and live events drive retention, monetization, and margin expansion. Read here for more analysis.",SeekingAlpha,0.9999995231628418,positive,Finnhub
NFLX,"Netflix, Inc.",2026-01-10 01:31:35,Netflix Stock Has A January Superpower — And The Numbers Prove It,"Netflix Inc. (NASDAQ:NFLX) has developed a striking seasonal pattern that traders have come to recognize: January has historically been its strongest month of the year, and by a wide margin. Over the past two decades, Netflix shares have posted an average January gain of 14.7%, finishing the month higher in 71% of years. That performance meaningfully outpaces both the broader S&P 500 and most large-cap technology peers over the same period, cementing January as a recurring sweet spot for the str",Yahoo,1.0,positive,Finnhub
NFLX,"Netflix, Inc.",2026-01-09 18:07:20,Netflix Shares Slide as Warner Bros. Bid Weighs on Valuation,Stock trades near 28 times forward earnings as investors focus on deal risks and growth outlook.,Yahoo,-0.9995926022529602,negative,Finnhub
NFLX,"Netflix, Inc.",2026-01-09 12:26:00,Why the Warner Bros. Deal Will Likely Make or Break Netflix's Stock Performance in 2026,"Since Netflix announced plans to buy Warner Bros., its stock has been falling.",Yahoo,-0.999713122844696,negative,Finnhub
NFLX,"Netflix, Inc.",2026-01-09 09:33:59,Netflix Update: Why Our Bear Case Strengthened After The Sell-Off,Netflix stock outlook: valuation still prices double-digit growth despite maturity. We see weaker IP and risky WBD bidâupgrade to Strong Sell.,SeekingAlpha,0.9989051818847656,positive,Finnhub
NFLX,"Netflix, Inc.",2026-01-09 09:21:54,Here’s Why CFRA Downgraded Netflix (NFLX) to Hold From Buy,"Netflix, Inc. (NASDAQ:NFLX) is one of the best major stocks to invest in right now. On January 5, Netflix, Inc. (NASDAQ:NFLX) was downgraded to Hold from Buy by CFRA, bringing the price target down to $100 from $130. The firm attributed the downgrade to the pending acquisition of Warner Bros Discovery by Netflix, Inc. (NASDAQ:NFLX), […]",Yahoo,-0.999832034111023,negative,Finnhub
NOW,"ServiceNow, Inc.",2026-01-19 11:02:08,Stifel Sees Long-Term Value in ServiceNow (NOW) Despite Near-Term Headwinds,"ServiceNow Inc. (NYSE:NOW) is among the best debt-free stocks to buy now. Stifel analyst Brad Reback, who rates NOW as Buy, flagged a potential near-term headwind for ServiceNow (NOW), according to a January 14 report by The Fly. The analyst identified a reduction in U.S. federal spending tied to workforce changes, with a Treasury Department contract […]",Yahoo,-0.9939769506454468,negative,Finnhub
NOW,"ServiceNow, Inc.",2026-01-19 09:19:23,Analysts Are Bullish on ServiceNow (NOW) – Here’s Why,"ServiceNow, Inc. (NYSE:NOW) is one of the best strong buy growth stocks to buy according to hedge funds. On January 14, Evercore ISI reiterated a Buy rating on ServiceNow, Inc. (NYSE:NOW) with a price target of $225. The same day, Oppenheimer also maintained a bullish outlook on the stock, maintaining a Buy rating with a […]",Yahoo,1.0,positive,Finnhub
NOW,"ServiceNow, Inc.",2026-01-18 11:16:08,Strong Analyst Sentiment on ServiceNow (NOW) Amid Strengthened Pipeline and AI Tailwinds,"ServiceNow, Inc. (NYSE:NOW) is one of the best stocks to buy right now. On January 12, 2026, analyst confidence in ServiceNow, Inc. (NYSE:NOW) appeared to be growing ahead of the company’s Q4 2025 earnings release, scheduled for January 28, 2026. The same day, Citi announced the opening of an “upside 30-day catalyst watch” on the […]",Yahoo,1.0,positive,Finnhub
NOW,"ServiceNow, Inc.",2026-01-17 11:45:36,"Why Analysts Stay Bullish on ServiceNow, Inc. (NOW) Despite a 28% Slide","ServiceNow, Inc. (NYSE:NOW) is among the stocks with the best earnings growth for the next 5 years. On January 13, Brian Schwartz, an analyst at Oppenheimer, reaffirmed a ‘Buy’ rating on ServiceNow, Inc. (NYSE:NOW). With a price target of $200, the stock has an upside potential of 68%. A day later, on January 14, Evercore […]",Yahoo,1.0,positive,Finnhub
NOW,"ServiceNow, Inc.",2026-01-16 20:40:00,1 Stock-Split Stock to Buy That Could Soar,ServiceNow's AI-powered platform helps businesses integrate AI tools into their daily workflows.,Yahoo,0.9999393224716187,positive,Finnhub
NOW,"ServiceNow, Inc.",2026-01-16 19:10:47,Here’s Why ServiceNow (NOW) Was Among Piper Sandler’s Top Picks For 2026,"ServiceNow, Inc. (NYSE:NOW) is one of the 15 software stocks with the highest upside potential. According to Piper Sandler’s January 5, 2026, outlook for Security and Infrastructure Software stocks, the stock is among the firm’s top 5 picks for 2026. Analyst Rob Owens and his team said that we remain cautiously optimistic for 2026, as […]",Yahoo,0.9907975196838379,positive,Finnhub
NOW,"ServiceNow, Inc.",2026-01-15 16:39:50,What Does Wall Street Think About ServiceNow (NOW)?,"ServiceNow, Inc. (NYSE:NOW) is one of the best long term growth stocks to buy according to hedge funds. On January 9, Stifel cut the price target on ServiceNow, Inc. (NYSE:NOW) to $200 from $230 while maintaining a Buy rating on the shares. In a note titled “4Q Should Be Fine; But Not Expecting Great”, the […]",Yahoo,-0.9872217774391174,negative,Finnhub
NOW,"ServiceNow, Inc.",2026-01-15 15:38:00,This Under-the-Radar AI Stock Is Poised for 50% Upside,"After shares lost 28% last year, ServiceNow is poised to recover on the back of a 98% customer retention rate and 30 consecutive quarterly earnings beats.",Yahoo,1.0,positive,Finnhub
NOW,"ServiceNow, Inc.",2026-01-15 13:15:23,"Why Goldman Sachs Is Betting on ServiceNow, Inc. (NOW)’s Long-Term Growth","ServiceNow, Inc. (NYSE:NOW) is among the most promising growth stocks according to analysts. On January 12, Goldman Sachs assumed coverage on ServiceNow, Inc. (NYSE:NOW) with a ‘Buy’ rating and a price target of $205, which suggests an upside potential of about 44%. According to the firm, AI adoption will be a “positive tailwind” to the […]",Yahoo,1.0,positive,Finnhub
NOW,"ServiceNow, Inc.",2026-01-15 13:00:00,"authID Announces Integration with ServiceNow to Deliver Secure, Frictionless Identity Verification & Authentication for Contact Centers","New integration empowers organizations to protect accounts, reduce fraud, and enhance trust across ServiceNow-powered contact centers Denver, CO, Jan. 15, 2026 (GLOBE NEWSWIRE) -- authID (Nasdaq: AUID), a leader in biometric identity authentication, today announced an integration with ServiceNow to securely verify identities at the contact center to protect accounts and reduce fraud. The collaboration enables authID to secure 8,400+ ServiceNow-powered contact centers globally, including 85% of F",Yahoo,0.9894084930419922,positive,Finnhub
NOW,"ServiceNow, Inc.",2026-01-15 10:49:46,Who is Winning AI Workflow Automation? We Compared 4 Enterprise Stocks.,"Enterprise software companies are racing to capture the AI automation opportunity, but exposure varies dramatically. We looked at Pegasystems (NASDAQ:PEGA), ServiceNow (NYSE:NOW), Microsoft (NASDAQ:MSFT), and Accenture (NYSE:ACN) to see which stands to benefit most from the workflow automation wave reshaping enterprise operations. The Automation Bet Taking Shape Enterprises are pouring resources into AI-powered workflow automation ... Who is Winning AI Workflow Automation? We Compared 4 Enterpri",Yahoo,0.9999094009399414,positive,Finnhub
NOW,"ServiceNow, Inc.",2026-01-14 11:00:00,DeepL Bolsters Executive Team with Former Salesforce and ServiceNow Leaders as New COO and CRO to Drive Global Growth,"DeepL, a global AI product and research company, today announced the appointment of Gavin Mee as Chief Operating Officer (COO) and Detlef Krause as Chief Revenue Officer (CRO). These strategic additions to DeepL's executive team mark a significant step forward in the company's mission to redefine AI enterprise solutions and accelerate its global growth trajectory.",Yahoo,0.9999988079071045,positive,Finnhub
NOW,"ServiceNow, Inc.",2026-01-13 15:00:00,inMorphis Recognized as a Major Contender in Everest Group's ServiceNow Services PEAK Matrix® Assessment 2025,"inMorphis today announced its positioning in the Everest Group ServiceNow Services PEAK Matrix® Assessment 2025, reaffirming its status as one of the most specialized, innovation-led ServiceNow partners for global enterprises. This recognition reflects inMorphis' strong delivery capabilities, industry-aligned solutions, and sustained investments in AI-driven transformation.",Yahoo,1.0,positive,Finnhub
NOW,"ServiceNow, Inc.",2026-01-11 18:59:41,Analysts Cut ServiceNow (NOW) Price Targets But Stay Positive,"ServiceNow, Inc. (NYSE:NOW) is one of the 10 Best NYSE Stocks to Buy According to Analysts. On January 8, Wells Fargo reduced its price target on ServiceNow, Inc. (NYSE:NOW) from $255 to $225 but kept its Overweight rating on the stock. Earlier, on January 5, RBC Capital also lowered its price target on ServiceNow, Inc. […]",Yahoo,-0.9785035252571106,negative,Finnhub
NOW,"ServiceNow, Inc.",2026-01-11 18:59:11,Piper Sandler Lowers PT on ServiceNow (NOW) Stock,"ServiceNow, Inc. (NYSE:NOW) is one of the Oversold Fundamentally Strong Stocks to Buy Right Now. On January 5, Piper Sandler analyst Rob Owens reduced the firm’s price objective on the company’s stock to $200 from $230, while keeping an “Overweight” rating. As per the firm, 2025 was a difficult year for Security & Infrastructure Software coverage. Notably, […]",Yahoo,-0.999993085861206,negative,Finnhub
NOW,"ServiceNow, Inc.",2026-01-10 13:37:17,ServiceNow (NOW) Stock Finds Support as Analysts See Upside to 2027 Growth,"ServiceNow, Inc. (NYSE:NOW) is one of the AI Stocks Gaining Attention on Wall Street. On January 5, Cantor Fitzgerald analyst Thomas Blakey reiterated an Overweight rating on the stock with a $240.00 price target. The firm is optimistic on the stock, driven by driven factors including seat growth, better-than-expected results in the Federal sector, artificial […]",Yahoo,1.0,positive,Finnhub
NOW,"ServiceNow, Inc.",2026-01-09 19:46:13,Jim Cramer Discusses ServiceNow (NOW)’s Business,"We recently published 11 Stocks on Jim Cramer’s Radar. ServiceNow, Inc. (NYSE:NOW) is one of the stocks on Jim Cramer radar. ServiceNow, Inc. (NYSE:NOW) is an enterprise software company that enables businesses to manage their daily processes. On January 5th, Cantor Fitzgerald reiterated an Overweight rating on the shares and kept a $240 share price target. […]",Yahoo,0.999994158744812,positive,Finnhub
NSC,Norfolk Southern Corporation,2026-01-16 22:48:00,Rail Regulator Sends $71.5 Billion Union Pacific-Norfolk Southern Deal Back for Redo,The Surface Transportation Board has said that the application is incomplete and is inviting the companies to revise and resubmit it.,Yahoo,-0.9763386845588684,negative,Finnhub
NSC,Norfolk Southern Corporation,2026-01-14 04:06:30,"Norfolk Southern (NSC): Buy, Sell, or Hold Post Q3 Earnings?","Norfolk Southern trades at $287.63 per share and has stayed right on track with the overall market, gaining 9.4% over the last six months. At the same time, the S&P 500 has returned 11.3%.",Yahoo,0.9999969005584717,positive,Finnhub
NSC,Norfolk Southern Corporation,2026-01-13 13:31:00,Norfolk Southern surpasses $18 million in donations for third straight year,"Norfolk Southern (NYSE: NSC) donated over $18.2 million in 2025 to charities across its 22-state network, supporting programs aligned with its community impact pillars: sustainability, safety, workforce development and thriving communities.",Yahoo,0.9991340041160583,positive,Finnhub
NVDA,NVIDIA Corporation,2026-01-19 11:59:23,Memory Bottlenecks Cloud NVIDIA’s (NVDA) Latest China Export Approval,"NVIDIA Corporation (NASDAQ:NVDA) is among the best debt-free stocks to buy now. Only a few days after receiving the green light for export to China (export approval), shipments of H200 AI processors have again taken center stage. On Thursday, January 15, Bloomberg reported that House Representative John Moolenaar raised concerns on the shortage of dynamic random-access […]",Yahoo,-0.999968409538269,negative,Finnhub
NVDA,NVIDIA Corporation,2026-01-19 11:43:00,Autonomous Driving Market Sees Robust Growth with CAGR of 17.63% Expected By 2033 | Astute Analytica,"The autonomous driving market is experiencing explosive growth, powered by rapid advancements in artificial intelligence (AI), sensor technologies, and sophisticated software platforms. Major players such as Waymo, Tesla, Nvidia, and Mobileye are at the forefront of shaping the autonomous driving landscape.Chicago, Jan. 19, 2026 (GLOBE NEWSWIRE) -- According to recent data from Astute Analytica, the global autonomous driving market was valued at US$ 170.22 billion in 2024 and is projected to hit",Yahoo,0.9999998807907104,positive,Finnhub
NVDA,NVIDIA Corporation,2026-01-19 11:35:14,"China Blocks Nvidia's H200 Shipments, Output Paused",Suppliers pause output after Chinese customs halt AI chip shipments.,Yahoo,-0.9999842643737793,negative,Finnhub
NVDA,NVIDIA Corporation,2026-01-19 11:04:00,Nvidia Faces Another Obstacle in China. But Wall Street Still Loves the Stock.,Nvidia stock trades at the same levels as it did last August. Analysts think that makes it a screaming buying opportunity.,Yahoo,0.9999778270721436,positive,Finnhub
NVDA,NVIDIA Corporation,2026-01-19 09:19:15,Where is NVIDIA Corporation (NVDA) Headed According to the Street?,"NVIDIA Corporation (NASDAQ:NVDA) is one of the best strong buy growth stocks to buy according to hedge funds. NVIDIA Corporation (NASDAQ:NVDA) received a rating update from Jefferies on January 16, with the firm lifting the price target on the stock to $275 from $250 and maintaining a Buy rating on the shares. The firm told […]",Yahoo,0.9999998807907104,positive,Finnhub
NVDA,NVIDIA Corporation,2026-01-19 09:02:00,"AI in Drug Discovery Market Research Report 2026-2040: NVIDIA, Insilico Medicine, Google DeepMind, Pfizer, and Roche Leveraging AI Platforms to Accelerate Development Timelines and Reduce R&D Costs","AI in drug discovery offers key market opportunities by enhancing drug development efficiency, reducing costs, and improving success rates. It supports personalized medicine, facilitating custom therapies. The market will grow due to investments, collaboration, and AI's role in addressing rising chronic conditions.Dublin, Jan. 19, 2026 (GLOBE NEWSWIRE) -- The ""AI in Drug Discovery Market, till 2040: Distribution by Drug Discovery Steps, Therapeutic Area, and Key Geographical Regions: Industry Tr",Yahoo,0.9999995231628418,positive,Finnhub
NVDA,NVIDIA Corporation,2026-01-19 08:57:18,Micron: Like 2023 Nvidia (But Better),"Micron Technology has surged over 200% in 12 months, driven by explosive AI-fueled memory demand. Click here to read my latest analysis of MU stock.",SeekingAlpha,1.0,positive,Finnhub
NVDA,NVIDIA Corporation,2026-01-19 06:58:00,"Palantir Billionaire Peter Thiel Sells Nvidia and Tesla Shares, Then Buys an AI Stock That's Up Nearly 460,000% Since Its IPO",This blue-chip staple is still a great long-term investment.,Yahoo,0.9999961853027344,positive,Finnhub
NVDA,NVIDIA Corporation,2026-01-19 01:10:39,What Eli Lilly (LLY)'s NVIDIA AI Lab And Obesity Data Reveal About Its Obesity Leadership Narrative,"In recent weeks, Eli Lilly has deepened its push into AI-driven drug discovery and obesity care, including a planned US$1.00 billion co-innovation lab with NVIDIA, new AI collaborations such as Chai Discovery and TuneLab integrations, and positive Phase 3b data combining Taltz with Zepbound in psoriatic arthritis and obesity. At the same time, Strive Compounding Pharmacy’s federal antitrust lawsuit against Eli Lilly and Novo Nordisk over compounded GLP-1 access underscores growing legal and...",Yahoo,0.9999995231628418,positive,Finnhub
NVDA,NVIDIA Corporation,2026-01-18 17:29:42,Jefferies Remains Bullish on NVIDIA Corporation (NVDA),"NVIDIA Corporation (NASDAQ:NVDA) is one of the best stocks to buy in 2026 for beginners. On January 16, Jefferies lifted the price target on NVIDIA Corporation (NASDAQ:NVDA) to $275 from $250 and reiterated a Buy rating, telling investors that the stock “remains pretty cheap”, trading at mid-teens multiple to its bottom-up implied calendar year 2027 […]",Yahoo,1.0,positive,Finnhub
NVDA,NVIDIA Corporation,2026-01-18 15:36:00,"Nvidia stock's next move hinges on Q4 earnings, Blackwell ramp","Nvidia (NVDA) enters its Q4 earnings cycle in a unique position. The stock has spent the last year riding AI's ""Hardware Wave,"" but 2026 marks the beginning of the ""Execution Era."" Investors are no longer just asking how many chips Nvidia can sell, but how fast those chips can deliver real-world ...",Yahoo,0.9999973773956299,positive,Finnhub
NVDA,NVIDIA Corporation,2026-01-18 15:15:00,"I Predicted Nvidia Was a Better Dow Stock Than Amazon in 2025, and I Was Right. But Which Is the Better ""Magnificent Seven"" Stock for 2026?",Wall Street is underestimating the growth potential of Nvidia's Rubin architecture.,Yahoo,-0.9924346208572388,negative,Finnhub
NVDA,NVIDIA Corporation,2026-01-18 14:15:00,"If You'd Invested $1,000 in Nvidia 5 Years Ago, Here's How Much You'd Have Today",Dominating the infrastructure layer of the AI boom has proved to be a very lucrative position to be in.,Yahoo,0.9995914101600647,positive,Finnhub
NVDA,NVIDIA Corporation,2026-01-18 11:16:19,Strong Analyst Sentiment on Advanced Micro Devices (AMD) Amid CES AI Processor Launches Despite Nvidia Competition,"Advanced Micro Devices, Inc. (NASDAQ:AMD) is included in our list of the best stocks to buy right now. As of January 12, 2026, 75% of analysts are bullish on Advanced Micro Devices, Inc. (NASDAQ:AMD). The consensus price target of $281.50 implies a 38.60% upside. Recent analyst commentaries reinforce the positive trend, with Jefferies reiterating a […]",Yahoo,1.0,positive,Finnhub
NVDA,NVIDIA Corporation,2026-01-18 10:50:00,"Nvidia CEO Jensen Huang Says, ""The Race Is On for AI."" Here's What It Means for Nvidia Stock.",AI development hit an inflection point that will power Nvidia into the future.,Yahoo,0.9999140501022339,positive,Finnhub
NVDA,NVIDIA Corporation,2026-01-18 09:30:06,"5 big analyst AI moves: Nvidia top 2026 pick, ASML gets big price target hike",Investing.com -- Here are the biggest analyst moves in the area of artificial intelligence (AI) for this week.,Yahoo,0.9921749234199524,positive,Finnhub
NVDA,NVIDIA Corporation,2026-01-18 05:54:25,Thermo Fisher Scientific Inc. (TMO) and NVIDIA Partner to Bring Advanced AI to Lab Workflows,"We recently compiled a list of the 10 Best Investments During A Recession. Thermo Fisher Scientific Inc. is placed second on our list. TheFly reported on January 9 that Stifel analyst Daniel Arias maintained a Buy rating on TMO and significantly raised the price target to $700 from $583, an increase of $117. According to […]",Yahoo,0.9999996423721313,positive,Finnhub
NVDA,NVIDIA Corporation,2026-01-18 04:20:00,I Predicted That Nvidia Would Beat the S&P 500 for the 3rd Consecutive Year in 2025. Here's Why the Streak Can Continue in 2026.,Nvidia continues to be a fundamentals-led growth story rather than one of hype and hot air.,Yahoo,0.9999998807907104,positive,Finnhub
