symbol,company_name,date,headline,summary,source,sentiment_score,sentiment_label,source_api
INTC,Intel Corporation,2026-01-14 15:51:41,Sold-Out AI Chips and Growing Foundry Buzz: Is Intel’s Rally Just Getting Started?,"Intel (NASDAQ:INTC) is experiencing a notable rally already in 2026, with the stock up 28% year-to-date, building on last year’s 84% rise. While the surge first gained traction after the U.S. government took a 9.9% stake in the chipmaker through an $8.9 billion equity investment last August, its advance lately has been driven more by ... Sold-Out AI Chips and Growing Foundry Buzz: Is Intel’s Rally Just Getting Started?",Yahoo,0.9999969005584717,positive,Finnhub
INTC,Intel Corporation,2026-01-14 15:01:00,Intel Stock Surges Toward 2-Year High. What Has the Market Excited.,Intel  stock was gaining again early Wednesday.  The chip company’s shares are on the brink of levels not seen for several years as investors bet President Donald Trump’s support for the company will boost its chip-manufacturing ambitions.  Intel was up 2.2% at $48.32 in morning trading.,Yahoo,1.0,positive,Finnhub
INTC,Intel Corporation,2026-01-14 14:10:00,The Intel Turnaround No One Saw Coming: Sold-Out Server CPUs and Apple Knocking at the Door,Multiple tailwinds are lifting Intel stock.,Yahoo,0.9999990463256836,positive,Finnhub
INTC,Intel Corporation,2026-01-14 12:45:02,KeyBanc Says Intel Has Made ‘Significant Progress.’ Does That Make INTC Stock a Buy Here?,Intel stock pushes higher as KeyBanc issues a bullish note in its favor. Here’s what the investment firm believes will drive INTC shares higher in 2026.,Yahoo,1.0,positive,Finnhub
INTC,Intel Corporation,2026-01-14 12:22:00,Intel Stock Surges Further Toward 2-Year High. What the Excitement’s About.,Intel  stock was gaining again early Wednesday.  The chip company’s shares are on the brink of levels not seen for several years as investors bet President Donald Trump’s support for the company will boost its chip-manufacturing ambitions.  Intel was up 1.6% at $48.06 in premarket trading.,Yahoo,0.9999998807907104,positive,Finnhub
INTC,Intel Corporation,2026-01-14 12:11:29,Intel Corp. (INTC) Soars to New Record High as Analyst Posts Bullish Outlook,"We recently published 10 Stocks Leaving Wall Street in the Dust; 4 Hit Fresh Records. Intel Corporation (NASDAQ:INTC) was one of the top performers on Tuesday. Intel Corp. soared to a nearly two-year high on Tuesday, as investors took path from an investment firm’s bullish outlook for its stock. At intra-day trading, the stock jumped […]",Yahoo,0.9999996423721313,positive,Finnhub
INTC,Intel Corporation,2026-01-14 10:51:00,"These Stocks Are Today’s Movers: Bank of America, Netflix, Nvidia, Fortinet, Intel, Rivian, and More","Bank of America, Wells Fargo, and Citigroup are set to report earnings Wednesday, a day after JPMorgan Chase posted a decline in quarterly profit.",Yahoo,-0.9998307228088379,negative,Finnhub
INTC,Intel Corporation,2026-01-14 06:30:00,Chart Of The Day: A 'Left For Dead' Stock Now Paying Off,The MoneyShow Chart of the Day shows how Intel Corp. shares have traded over the last two years. The stock has been moving nicely higher for months - and now itâs breaking out to the upside.,SeekingAlpha,0.9999901056289673,positive,Finnhub
INTC,Intel Corporation,2026-01-14 05:01:00,Intel Rediscovers Key to Foundry Success,The progress has earned Intel praise from one particularly important member of the audience: President Trump.,Yahoo,0.9999946355819702,positive,Finnhub
INTC,Intel Corporation,2026-01-13 22:17:10,"Stock Market Today, Jan. 13: Intel Jumps on KeyBanc Upgrade Highlighting Strong AI Server CPU Demand","On Jan. 13, 2026, a bullish analyst call and sold-out AI server capacity reframed this chip giant’s turnaround potential.",Yahoo,1.0,positive,Finnhub
INTC,Intel Corporation,2026-01-13 21:43:00,"JPMorgan, Delta, Intel, AMD, Adobe, Moderna, Super Micro, and More Stock Market Movers",Stocks fell Tuesday after the latest data from the Bureau of Labor Statistics showed inflation held steady in December as prices for goods and services rose 2.7%.  JPMorgan Chase  fell 4.2%.  Earnings of $4.63 a share fell short of analysts’ calls for $4.85.,Yahoo,-0.9999955892562866,negative,Finnhub
INTC,Intel Corporation,2026-01-13 19:51:06,"AMD, Intel Pop After a Pair of Upgrades. Here’s Why One Wall Street Bull Likes the Stocks","Intel and AMD shares surged Tuesday after KeyBanc analysts upgraded the stocks, pointing to strong AI demand.",Yahoo,0.9999997615814209,positive,Finnhub
INTC,Intel Corporation,2026-01-13 17:55:57,Market Movers: Wall Street Loves Big Tech as 2026 Kicks Off,"Analysts at KeyBanc just upgraded Intel (NASDAQ: INTC) and Advanced Micro Devices (NASDAQ: AMD) to an overweight rating, noting that both are benefiting from hyperscaler demand. As a result, AMD is up about $7.67 in premarket. INTC is up about $1.80 a share. The firm raised its price target on INTC. “Analyst John Vinh pointed ... Market Movers: Wall Street Loves Big Tech as 2026 Kicks Off",Yahoo,1.0,positive,Finnhub
INTC,Intel Corporation,2026-01-13 17:44:00,"Intel, AMD Get Overweight Upgrades as 2026 Server Chips Sell Out",KeyBanc sees strong AI-driven demand and potential price hikes ahead.,Yahoo,1.0,positive,Finnhub
INTC,Intel Corporation,2026-01-13 17:42:24,Intel Stock Jumps After Top Analyst Boosts Rating to 'Overweight',Intel Stock Jumps on Strong AI Infrastructure Orders,Yahoo,1.0,positive,Finnhub
INTC,Intel Corporation,2026-01-13 17:01:20,Why Intel (INTC) Stock Is Trading Up Today,Shares of computer processor maker Intel (NASDAQ:INTC) jumped 6.2% in the morning session after Keybanc upgraded the stock's rating to 'Overweight' from 'Sector Weight' and set a new price target of $60.,Yahoo,0.9999998807907104,positive,Finnhub
INTC,Intel Corporation,2026-01-13 16:49:00,Intel Stocks Surges. It’s Shaping Up to Be a Good Year for Chip Makers.,"Intel  stock was gaining Tuesday after getting upgraded at KeyBanc.  It’s set to be a good year for makers of central processing units, including  Advanced Micro Devices  the analysts say.  Analyst John Vinh raised his rating on both Intel and AMD to Overweight, noting the companies appear to have largely sold out their server CPUs for this year amid the boom in artificial-intelligence infrastructure.",Yahoo,1.0,positive,Finnhub
INTC,Intel Corporation,2026-01-13 16:35:52,"Intel (INTC) CEO is Doing An Amazing Job, Says Jim Cramer","We recently published 9 Stocks on Jim Cramer’s Radar. Intel Corporation (NASDAQ:INTC) is one of the stocks on Jim Cramer’s radar. Chip manufacturing giant Intel Corporation (NASDAQ:INTC)’s shares are up by 137% over the past year. In 2026, the stock is up by 19.9% year-to-date. A key catalyst for the stock came in January after the […]",Yahoo,0.9999979734420776,positive,Finnhub
INTC,Intel Corporation,2026-01-13 16:30:50,"Intel stock rises on analyst upgrade citing data center AI demand, 'significant progress' in manufacturing",KeyBanc analyst John Vinh upgraded Intel to Overweight from Sector Weight.,Yahoo,0.999994158744812,positive,Finnhub
INTC,Intel Corporation,2026-01-13 13:00:24,"Here Are Tuesday’s Top Wall Street Analyst Research Calls: Adobe, AMD, Disney, Five Below, Intel, Reddit, KLA Corp, PayPal, Super Micro Computer and More","Pre-Market Stock Futures: The futures are trending higher after the December consumer price index came in at 2.6% below Wall Street expectations. The reversal in the futures comes after a wild Monday that saw stocks get hammered on the open, amid news of Department of Justice subpoenas sent to Federal Reserve Chairman Jay Powell regarding ... Here Are Tuesday’s Top Wall Street Analyst Research Calls: Adobe, AMD, Disney, Five Below, Intel, Reddit, KLA Corp, PayPal, Super Micro Computer and More",Yahoo,-0.7395015358924866,negative,Finnhub
INTC,Intel Corporation,2026-01-13 12:42:00,"These Stocks Are Today’s Movers: JPMorgan, Delta, L3Harris, Intel, AMD, BNY Mellon, and More","Stock futures were falling Tuesday as investors digested quarterly results from  JPMorgan Chase  and  Delta Air Lines  both of which kicked off the earnings season.  JPMorgan Chase  rose 0.4%.  Although the bank’s profit declined 7% in the fourth quarter, revenue rose on the back of higher fees and interest income.",Yahoo,0.9993273019790649,positive,Finnhub
INTC,Intel Corporation,2026-01-13 12:00:25,KeyBanc upgrades Intel and AMD on surging hyperscaler demand,"Investing.com -- KeyBanc Capital Markets has upgraded Intel and AMD to Overweight, citing stronger-than-expected data-center demand and tightening memory supply across the semiconductor industry.",Yahoo,1.0,positive,Finnhub
INTC,Intel Corporation,2026-01-13 11:42:00,Intel Stock Gains. Why the Chip Company and AMD Got Upgrades.,"Intel  and  Advanced Micro Devices  were gaining early on Monday.  It’s set to be a good year for makers of central processing units, according to KeyBanc.  Analyst John Vinh raised his rating on both Intel and AMD to Overweight, noting the companies appear to have largely sold out their server CPUs for this year amid the boom in artificial-intelligence infrastructure.",Yahoo,1.0,positive,Finnhub
INTC,Intel Corporation,2026-01-12 19:17:27,"As Trump Says He Is ‘Proud’ of Intel, Should You Buy INTC Stock?",Intel stock rose 10% on Friday and is up 137% in the past year as the chipmaker aims to expand its AI manufacturing capabilities.,Yahoo,0.9999998807907104,positive,Finnhub
INTC,Intel Corporation,2026-01-12 15:01:00,Intel Stock Gets a Higher Price Target. Why Wall Street Doesn’t Trust the Gains.,The chip stock has rallied hard following President Donald Trump's praise for its CEO. Analysts still see issues for the company.,Yahoo,-0.9996728897094727,negative,Finnhub
INTC,Intel Corporation,2026-01-12 12:50:00,Intel (INTC) Soars 10.8%: Is Further Upside Left in the Stock?,Intel (INTC) was a big mover last session on higher-than-average trading volume. The latest trend in earnings estimate revisions might not help the stock continue moving higher in the near term.,Yahoo,0.9996097683906555,positive,Finnhub
INTC,Intel Corporation,2026-01-12 12:21:22,Intel Rally Builds Momentum After 18A Chip Launch and Policy Support,"Analysts see U.S. incentives, leadership changes, and advanced chip rollout driving renewed investor confidence.",Yahoo,1.0,positive,Finnhub
INTC,Intel Corporation,2026-01-12 00:56:02,Intel: The Bull Move Is Just Beginning With 18A Chips Shipment,"Intel is in the early stages of a major bull run, supported by U.S. policy favoring domestic chip production. Read why INTC stock is upgraded to a Strong Buy.",SeekingAlpha,1.0,positive,Finnhub
INTC,Intel Corporation,2026-01-11 02:31:15,Trump Says Federal Intel Stake Has Made 'Tens Of Billions': Stock Climbs,"President Donald Trump boasted about Intel Corp. (NASDAQ:INTC) new processors and the U.S. government’s stake in the company late Thursday afternoon. Intel shares moved higher. In a social media post, Trump said he had just completed a “great meeting with the very successful Intel CEO, Lip-Bu Tan.” “Intel just launched the first SUB 2 NANOMETER CPU PROCESSOR designed, built, and packaged right here in the U.S.A.,” Trump said. Don't Miss: Missed Nvidia and Tesla? RAD Intel Could Be the Next AI Po",Yahoo,0.9937248826026917,positive,Finnhub
INTC,Intel Corporation,2026-01-10 09:25:00,Intel Stock Just Keeps Soaring. Is It Too Late to Buy?,"Intel's stock has surged on fresh political support and product momentum, as its turnaround appears to be gaining traction.",Yahoo,1.0,positive,Finnhub
INTC,Intel Corporation,2026-01-09 22:53:27,"Stock Market Today, Jan. 9: Intel Surges After Trump Praises CEO Lip-Bu Tan and Touts U.S. Chip Leadership","On Jan. 9, 2026, investors weighed Trump’s “national champion” nod alongside Intel’s 1.8 nanometer CPU momentum.",Yahoo,0.9992969036102295,positive,Finnhub
INTC,Intel Corporation,2026-01-09 22:10:37,"Stock Market Today, Jan. 9: S&P 500 Sets New High and Intel Rallies","Positive jobs data and high-profile political backing for Intel pushed major U.S. indexes toward new highs, today, Jan. 9, 2026.",Yahoo,0.9999839067459106,positive,Finnhub
INTC,Intel Corporation,2026-01-09 21:43:00,"These Stocks Moved the Most Today: Oklo, Vistra, Opendoor, Intel, GM, Revolution Medicines, Tilray, and More",Stocks rose Friday after fresh jobs data showed U.S. unemployment ticked down in December and a potential Supreme Court ruling on tariffs failed to pan out.  Vistra  stock surged 11% and  Oklo  jumped 7.9% after the nuclear energy companies unveiled separate agreements to provide power to  Meta Platforms  in order to support the hyperscaler’s data-center campus in Ohio.  Meta inched up 1.1%.,Yahoo,0.9877316355705261,positive,Finnhub
INTC,Intel Corporation,2026-01-09 15:52:09,"Intel CEO Meets With Trump, Who Hails Chipmaker’s Progress","In a post to his Truth Social network, Trump hailed what he called progress at Santa Clara, California-based Intel, whose shares are up more than 70% since plans emerged last year for the federal government to buy as much as 10% of the company.  “I just finished a great meeting with the very successful Intel CEO, Lip-Bu Tan,” Trump wrote.",Yahoo,0.9973211884498596,positive,Finnhub
INTC,Intel Corporation,2026-01-09 18:40:48,Here's What President Trump Said About Intel's CEO That's Boosting the Stock Friday,"President Trump said he had a ""great meeting"" with Intel CEO Lip-Bu Tan, sending shares of the chipmaker soaring Friday.",Yahoo,0.9900863766670227,positive,Finnhub
INTC,Intel Corporation,2026-01-09 18:22:01,Intel Stock Pops After Trump Praises CEO Lip-Bu Tan,S&P 500 and Nasdaq Rise as December Jobs Data Surprises Investors,Yahoo,0.9963679313659668,positive,Finnhub
INTC,Intel Corporation,2026-01-09 18:14:18,Intel's Turnaround Gets Washington Attention,Trump praise spotlights U.S. chip ambitions,Yahoo,0.9966068267822266,positive,Finnhub
INTC,Intel Corporation,2026-01-09 17:30:50,Intel Rises After Trump Meeting as Markets Await Jobs Data,Chipmaker gains premarket; GM slides on $7.1B charge tied to EV pullback.,Yahoo,0.9999262094497681,positive,Finnhub
INTC,Intel Corporation,2026-01-09 11:11:35,Intel stock jumps 7% after CEO meets with Trump as U.S. stake doubles value,President Donald Trump praised Intel CEO Lip-Bu Tan following their meeting and the boost to U.S. chip manufacturing.,CNBC,0.9999997615814209,positive,Finnhub
INTC,Intel Corporation,2026-01-09 11:03:28,"Stocks to Watch Friday: Intel, GM, Rio Tinto, Glencore","↗️ Intel (INTC): President Trump said late Thursday he had ""just finished a great meeting"" with Intel CEO Lip-Bu Tan. The chipmaker's shares gained 2.5% in premarket trading. The U.S. has said it will convert around $9 billion in federal grants into a 10% equity stake in Intel.",Yahoo,0.9796602129936218,positive,Finnhub
INTC,Intel Corporation,2026-01-09 09:21:39,Intel Corporation (INTC) Launches Next Generation of AI PCs at CES 2026,"Intel Corporation (NASDAQ:INTC) is one of the Best Unstoppable Growth Stocks to Buy Right Now. On December 5, Intel Corporation (NASDAQ:INTC) launched its next generation of AI PCs at CES 2026. The company launched its Core Ultra Series 3 processors. Management noted the processors feature the first compute platform built on Intel 18A, which is […]",Yahoo,0.999896764755249,positive,Finnhub
INTC,Intel Corporation,2026-01-09 05:09:01,Semiconductor stocks boosted by Donald Trump's praise for Intel and its CEO,"Intel shares rose 2% in extended trading on Thursday after Trump said he had ""a great meeting with the very successful Intel CEO, Lip-Bu Tan.""",CNBC,0.9999998807907104,positive,Finnhub
INTU,Intuit Inc.,2026-01-18 14:00:00,‘No reasons to own’: Software stocks sink on fear of new AI tool,"The release of a new artificial intelligence tool from startup Anthropic on Jan. 12 rekindled fears about disruption that weighed on software makers in 2025.  TurboTax owner Intuit Inc. tumbled 16% last week, its worst since 2022, while Adobe Inc. and Salesforce Inc., which makes customer relationship management software, both sank more than 11%.  All told, a group of software-as-a-service stocks tracked by Morgan Stanley is down 15% so far this year, following a drop of 11% in 2025.",Yahoo,-0.9999840259552002,negative,Finnhub
INTU,Intuit Inc.,2026-01-15 11:00:00,"Intuit TurboTax Opens NYC Flagship, Uniting AI and Human Expertise to Reinvent In-Person Tax Filing Nationwide","NEW YORK, January 15, 2026--Intuit Inc. (Nasdaq: INTU), the global financial technology platform that makes Intuit TurboTax, Credit Karma, QuickBooks, and Mailchimp, today opened its new Intuit TurboTax flagship store in New York City’s SoHo neighborhood, reimagining the future of personal and small business tax filing by combining the power of its all-in-one, agentic AI-driven consumer platform and human intelligence (HI) to deliver the ultimate done-for-you tax experience. The opening of the n",Yahoo,0.9526055455207825,positive,Finnhub
INTU,Intuit Inc.,2026-01-15 10:07:55,"Intuit ""could bounce from here"" after early year slump - Jefferies","Investing.com - Shares of Intuit slumped by more than 6% on Wednesday, in the latest leg lower for a software name that has stumbled in the early weeks of 2026.",Yahoo,-0.9999970197677612,negative,Finnhub
INTU,Intuit Inc.,2026-01-14 17:53:10,Goldman Sachs Assumes Coverage of Intuit (INTU) Stock,"Intuit Inc. (NASDAQ:INTU) is one of the Best Fundamental Stocks to Buy According to Analysts. On January 11, Goldman Sachs analyst Gabriela Borges assumed coverage of the company’s stock with a “Neutral” rating and a price objective of $720. According to the firm, the adoption of AI will be a positive tailwind for the software total […]",Yahoo,1.0,positive,Finnhub
INTU,Intuit Inc.,2026-01-13 16:30:00,Intuit Inc. stock outperforms competitors despite losses on the day,Intuit Inc. stock outperforms competitors despite losses on the day,MarketWatch,0.999957799911499,positive,Finnhub
INTU,Intuit Inc.,2026-01-13 15:38:52,"BDO Canada, Intuit team up to serve small and mid-sized businesses",The service will enable businesses to make data-driven business decisions and benefit from financial insights.,Yahoo,0.9986751675605774,positive,Finnhub
INTU,Intuit Inc.,2026-01-12 15:00:00,BDO Canada and Intuit QuickBooks Partner to Redefine How BDO Serves Small and Mid-sized Businesses with New Integrated Service,"BDO Canada LLP and Intuit Inc. (Nasdaq: INTU), the global financial technology platform that makes Intuit TurboTax, Credit Karma, QuickBooks, and Mailchimp, today announced a strategic partnership that combines the innovative technology of Intuit's platform with BDO advisors' human insight, to redefine BDO's service offering by providing forward-looking and actionable insights for small and mid-sized businesses across Canada.",Yahoo,0.8523568511009216,positive,Finnhub
IT,"Gartner, Inc.",2026-01-19 05:06:25,Is Gartner (IT) Ready if Enterprise AI Tools Cannibalize Its Core Advisory Revenue Model?,"Gartner, Inc.’s Data & Analytics Summit 2026 took place in Sydney from 16–17 January, as the firm highlighted trends in enterprise AI spending and organizational readiness for adoption. At the same time, investors are weighing Gartner’s forecasts for very large global AI investment against slowing contract renewals, margin pressure, and concerns that AI tools could erode demand for its traditional advisory services. Next, we’ll examine how concerns over slowing contract renewals and margin...",Yahoo,-0.9169267416000366,negative,Finnhub
IT,"Gartner, Inc.",2026-01-16 16:35:15,"Gartner's Contract Value May Have Bottomed, Setting Up 'Modest Recovery,' RBC Says","Gartner (IT) likely hit the low point of its contract value metric in Q4 and is on a path toward a """,Yahoo,0.9993411898612976,positive,Finnhub
IT,"Gartner, Inc.",2026-01-15 19:07:03,Why Gartner Stock Was Cut In Half In 2025,The consulting firm is facing risks from artificial intelligence.,Yahoo,-0.9999897480010986,negative,Finnhub
IT,"Gartner, Inc.",2026-01-15 16:01:00,Omnissa Ranks Highest Across All Four Use Cases in the Gartner® Critical Capabilities for Endpoint Management Tools Report,"MOUNTAIN VIEW, Calif., January 15, 2026--Omnissa today announced it has been named a Leader in the inaugural 2026 Gartner® Magic Quadrant™ for Unified Endpoint Management (UEM) Tools and ranked the highest across all four Use Cases in the Gartner® Critical Capabilities for Endpoint Management Tools report. Omnissa received its highest score in the Autonomous Endpoint Management Use Case, scoring 4.95 out of a 5.0 ranking. In the Magic Quadrant report, Omnissa is positioned as a Leader based on t",Yahoo,1.0,positive,Finnhub
IT,"Gartner, Inc.",2026-01-15 11:59:00,Accenture Named a Leader in Gartner® Magic Quadrant™ for Digital Technology and Business Consulting Services,"NEW YORK, January 15, 2026--Accenture was recognized as a Leader in the inaugural Gartner, Inc. ""Magic Quadrant for Digital Technology and Business Consulting Services"" report.",Yahoo,0.9991369843482971,positive,Finnhub
IT,"Gartner, Inc.",2026-01-14 14:15:32,Will Gartner (IT) be Able to Reaccelerate Its Organic Growth?,"Oakmark Funds, advised by Harris Associates, released its “Oakmark Global Fund” fourth-quarter 2025 investor letter. The fund’s objective is long-term capital appreciation by investing in a diverse group of U.S. and non-U.S. companies. The all-cap mandate of the fund allows it to invest across all market-cap companies. A copy of the letter can be downloaded here. In […]",Yahoo,0.8091291785240173,positive,Finnhub
IT,"Gartner, Inc.",2026-01-14 03:46:00,Weaviate named a Leader and Outperformer by GigaOm and Emerging Leader by Gartner; Market Momentum Accelerates as Nonrelational DBMS Segment Grows 22.7%,"Rapid delivery of new features positions Weaviate at the forefront of a booming market driven by enterprise adoption of generative AI. Weaviate Weaviate Amsterdam City, Jan. 13, 2026 (GLOBE NEWSWIRE) -- Weaviate, the AI database company, today announced it has been recognized as a Leader and Outperformer in the 2025 GigaOm Radar for Vector Databases. This recognition highlights Weaviate’s advanced capabilities in multimodality and agentic AI at a time when the broader database market is undergoi",Yahoo,1.0,positive,Finnhub
IT,"Gartner, Inc.",2026-01-13 14:00:00,Teradata Included in Gartner Peer Insights™ Voice of the Customer for Data Science and Machine Learning Platforms,Teradata (NYSE: TDC) announced its inclusion in the 2025 Gartner Peer Insights™ Voice of the Customer for Data Science and Machine Learning (DSML) Platforms. This recognition highlights direct feedback from verified customers on their real-world experience with Teradata's DSML capabilities and platform performance.,Yahoo,0.77838134765625,positive,Finnhub
IT,"Gartner, Inc.",2026-01-12 14:00:00,Tenable Named a Customers’ Choice in the 2025 Gartner® Peer Insights™ Voice of the Customer for Cloud-Native Application Protection Platforms,"COLUMBIA, Md., Jan. 12, 2026 (GLOBE NEWSWIRE) -- Tenable® Holdings, Inc. (NASDAQ: TENB), the exposure management company, today announced it has been recognized as one of only two vendors recognized as a 2025 Customers’ Choice in the Gartner Peer Insights™ ‘Voice of the Customer’: Cloud-Native Application Protection Platforms (CNAPPs). Based solely on end-user reviews, Tenable credits this Customers' Choice distinction to its strong customer advocacy and satisfaction, with a 4.8 out of 5 overall",Yahoo,0.9999997615814209,positive,Finnhub
IT,"Gartner, Inc.",2026-01-12 13:00:00,BMC is recognized as a 2025 Gartner® Peer Insights™ Customers' Choice for Service Orchestration and Automation Platforms,"BMC, a global leader in software solutions enabling business faster than humanly possible, announced today that it was named a Customers' Choice in the 2025 Gartner Peer Insights 'Voice of the Customer': Service Orchestration and Automation Platforms [1] report. Gartner defines Service Orchestration and Automation Platforms as encompassing solutions that empower organizations to manage and automate their entire technology stack, including workloads, workflows, resource provisioning, and data pip",Yahoo,0.99952232837677,positive,Finnhub
IT,"Gartner, Inc.",2026-01-09 17:11:43,Gartner (IT) Valuation Check As AI Disruption Concerns And Recent Weak Quarter Weigh On Sentiment,"Recent commentary around Gartner (IT) has focused on how artificial intelligence may be cutting into demand for its research services, with Jim Cramer highlighting the stock’s sharp 2025 underperformance and a recent quarter he described as disappointing. See our latest analysis for Gartner. Recent price action reflects this tension. Gartner’s 30 day share price return of 7.6% and year to date gain of 4.1% contrast with a 1 year total shareholder return decline of 50.2%, suggesting longer...",Yahoo,-0.9999589920043945,negative,Finnhub
IT,"Gartner, Inc.",2026-01-09 17:10:06,Will Gartner (IT) Beat Estimates Again in Its Next Earnings Report?,Gartner (IT) has an impressive earnings surprise history and currently possesses the right combination of the two key ingredients for a likely beat in its next quarterly report.,Yahoo,1.0,positive,Finnhub
JOBY,"Joby Aviation, Inc.",2026-01-19 08:02:36,Joby Aviation: A Billion Dollars Says They Can Fly (But Can They Earn?),"Joby Aviation is a Hold due to elevated valuation, regulatory risks, and concerning cash burn despite strong management communication. Read more on JOBY stock.",SeekingAlpha,-0.9999438524246216,negative,Finnhub
