symbol,company_name,date,headline,summary,source,sentiment_score,sentiment_label,source_api
PLTR,Palantir Technologies Inc.,2026-02-25 05:09:33,Palantir Move To Miami Tests Governance Concerns And Growth Expectations,"Palantir Technologies (NasdaqGS:PLTR) is relocating its headquarters from Denver to Miami, signaling a major shift in its corporate base. The company faces corporate governance concerns after scrutiny of CEO Alex Karp’s high private jet reimbursements. Palantir is under public sector scrutiny as it pursues new government healthcare contracts and a lawsuit against a Swiss magazine. At the same time, Palantir is expanding global partnerships, including work with Rackspace and Innodata to...",Yahoo,-0.9998747110366821,negative,Finnhub
PLTR,Palantir Technologies Inc.,2026-02-25 02:48:16,Palantir (PLTR) Balances Growth Deals with Investor Doubts,"Palantir Technologies Inc. (NASDAQ:PLTR) is one of Goldman Sachs’s top growth stock picks. On February 18, Palantir Technologies Inc. (NASDAQ:PLTR) named Rackspace Technology its dedicated data migration and global implementation partner for its two flagship platforms, Foundry and Artificial Intelligence Platform, or AIP. Foundry facilitates enterprise data integration and analytics, and AIP operationalizes AI in […]",Yahoo,0.8704578876495361,positive,Finnhub
PLTR,Palantir Technologies Inc.,2026-02-24 23:33:00,Palantir faces a ‘quiet shockwave’ from a small deal with big optics,"Palantir (PLTR) is having the kind of year that most data analytics companies can only dream about. The AI-focused company's financial statistics are incredibly strong, strapped, in effect, to a rocket ship. Still, headlines find a way to complicate the trade. Shares have recently changed hands for ...",Yahoo,0.911558210849762,positive,Finnhub
PLTR,Palantir Technologies Inc.,2026-02-24 21:05:00,Is Palantir Stock Overvalued or Dirt Cheap? The Answer Might Blow Your Mind.,"Palantir Technologies stock has risen 1,640% throughout the artificial intelligence (AI) revolution.",Yahoo,0.9995379447937012,positive,Finnhub
PLTR,Palantir Technologies Inc.,2026-02-24 20:00:00,Palantir and 2 High-Momentum Stocks to Buy Now for Big Gains,"Palantir has emerged as a standout momentum play under the Driehaus strategy, backed by strong earnings surprises and a solid uptrend signal.",Yahoo,1.0,positive,Finnhub
PLTR,Palantir Technologies Inc.,2026-02-24 17:37:01,Buying In-the-Money Palantir Calls Looks Attractive Here for Value Buyers,Long-term PLTR investors can afford to buy cheap in-the-money (ITM) PLTR call options six months away by selling short PLTR put options. This article shows one play that looks especially attractive.,Yahoo,1.0,positive,Finnhub
PLTR,Palantir Technologies Inc.,2026-02-24 16:39:05,Palantir Stock Drops 38%. Should You Buy PLTR for 2026 or Stay Away?,"Palantir stock has pulled back from its 52-week high. However, the company’s underlying business momentum remains solid in 2026.",Yahoo,1.0,positive,Finnhub
PLTR,Palantir Technologies Inc.,2026-02-24 15:40:21,Palantir Is in a ‘Category of One.’ Why Mizuho Says You Should Buy PLTR Stock Now.,"Mizuho upgraded Palantir to “Outperform,” arguing the company is in a “category of one” thanks to its exceptional growth and margin expansion.",Yahoo,1.0,positive,Finnhub
PLTR,Palantir Technologies Inc.,2026-02-24 09:53:30,Why Are Palantir Technologies Shares Sliding Tuesday?,"Palantir Technologies Inc (PLTR) shares are extending their slide into Tuesday&#39;s premarket session as investors grapple with a confluence of competitive, governance, and legal pressures.",Benzinga,-0.9533888101577759,negative,Finnhub
PLTR,Palantir Technologies Inc.,2026-02-24 08:16:00,Prediction: Here's How Much Further Palantir Stock Could Fall,"Palantir is growing fast and printing profits, but the stock is still priced for years of near-perfect execution.",Yahoo,0.9998576641082764,positive,Finnhub
PLTR,Palantir Technologies Inc.,2026-02-24 03:50:00,"Down 35% From Its All-Time High, Should You Buy the Dip on Palantir Stock?","Palantir has delivered incredible results recently, so why is the stock down?",Yahoo,0.999983549118042,positive,Finnhub
PLTR,Palantir Technologies Inc.,2026-02-23 22:48:36,"Stock Market Today, Feb. 23: Palantir Falls as Market Pullback and Governance Questions Weigh",Palantir declined as tariff worries and broader risk-off sentiment weighed on AI software stocks. Governance disclosures and mixed institutional positioning added to the cautious tone.,Yahoo,-0.9999822378158569,negative,Finnhub
PLTR,Palantir Technologies Inc.,2026-02-23 22:05:00,3 Predictions for Palantir in 2026,Palantir has been one of the hottest stocks of the past three years.,Yahoo,0.9366610646247864,positive,Finnhub
PLTR,Palantir Technologies Inc.,2026-02-23 20:02:25,"Play the ‘SaaS Apocalypse’ Selloff in Palantir Stock With This 1 Winning, Protective Options Trade",Here’s a winning framework for a married put spread on Palantir.,Yahoo,0.996163010597229,positive,Finnhub
PLTR,Palantir Technologies Inc.,2026-02-23 17:45:03,"Is Palantir Technologies (PLTR) a Solid Growth Stock? 3 Reasons to Think ""Yes""","Palantir Technologies (PLTR) is well positioned to outperform the market, as it exhibits above-average growth in financials.",Yahoo,1.0,positive,Finnhub
PLTR,Palantir Technologies Inc.,2026-02-23 17:01:53,Why Palantir Technologies Stock Is Down Today,Palantir Stock Slides About 4% as Tariff Jitters Weigh on Tech,Yahoo,-0.9999605417251587,negative,Finnhub
PLTR,Palantir Technologies Inc.,2026-02-23 13:47:00,Buy Palantir on Recent Softness Amid Massive Short-Term Price Upside,"PLTR trades 34.8% below its high despite surging revenue, rapid AI expansion and guidance calling for 61% growth and strong cash flow in 2026.",Yahoo,1.0,positive,Finnhub
PLTR,Palantir Technologies Inc.,2026-02-22 16:52:24,Palantir (PLTR) Called a “Category of One” as Analysts Upgrade the Stock,"Palantir Technologies Inc. (NASDAQ:PLTR) is one the Top 10 AI Stocks in Focus on Wall Street. Palantir Technologies Inc. (NASDAQ: PLTR) has received fresh analyst support after analysts pointed out a significantly de-risked valuation following a steep contraction in its forward multiples. On February 18, Mizuho analyst Gregg Moskowitz upgraded the stock from Neutral to Outperform […]",Yahoo,0.9997311234474182,positive,Finnhub
PLTR,Palantir Technologies Inc.,2026-02-22 15:24:49,"Phillip Securities Cuts Palantir (PLTR) Target, Reiterates Buy Rating Again","Palantir Technologies Inc. (NASDAQ:PLTR) is one of the 10 Best Stocks to Buy in 2026 According to Reddit. On February 16, 2026, Phillip Securities analyst Paul Chew lowered the price target on Palantir Technologies Inc. (NASDAQ:PLTR) to $190 and reiterated a Buy rating on the stock. The firm had initiated coverage on the stock with […]",Yahoo,0.9999704360961914,positive,Finnhub
PLTR,Palantir Technologies Inc.,2026-02-22 14:20:00,"2 ETFs Robinhood Retail Investors Favor Over Palantir, Alphabet, Meta, and Netflix Shares","It is no wonder, considering this was the best January ever for ETF inflows.",Yahoo,0.9998996257781982,positive,Finnhub
PLTR,Palantir Technologies Inc.,2026-02-22 14:00:02,"If Palantir is Near a Bottom, What's the Best Play in PLTR Stock?","Palantir put options have high premiums for out-of-the-money exercise prices, making them attractive to short-sellers. For example, selling short a 7% lower exercise put yields 3.7% over one month and 2.7% with a 11% lower put strike price.",Yahoo,0.999985933303833,positive,Finnhub
PLTR,Palantir Technologies Inc.,2026-02-22 00:20:00,"Is Palantir a Buy, Sell, or Hold in 2026?",Palantir has been caught in the SaaS sell-off.,Yahoo,-0.6977171897888184,negative,Finnhub
PLTR,Palantir Technologies Inc.,2026-02-20 21:53:00,Better Software Stock: Palantir vs. BigBear.ai,The U.S. military relies on both to provide AI-powered software.,Yahoo,0.9999063014984131,positive,Finnhub
PLTR,Palantir Technologies Inc.,2026-02-20 16:51:32,Rackspace Surges Another 50% Higher on Palantir AI Partnership Hype,"Rackspace Technology (NASDAQ:RXT) continues to experience an extraordinary rally following the announcement of a strategic alliance with Palantir Technologies (NYSE:PLTR). The stock, which was trading at a mere $0.42 per share just days ago, exploded by 227% in the immediate aftermath of the announcement, and is surging another 50% in morning trading today, pushing its ... Rackspace Surges Another 50% Higher on Palantir AI Partnership Hype",Yahoo,0.9999997615814209,positive,Finnhub
PLTR,Palantir Technologies Inc.,2026-02-20 14:20:17,"Down 24% in 2026, Where Is Palantir Stock Headed Next and Should You Buy PLTR Here?","Palantir stock has been in a freefall this year amid a broader software rout, but Mizuho believes PLTR shares will recover sharply as the year unfolds.",Yahoo,0.9996808767318726,positive,Finnhub
PLTR,Palantir Technologies Inc.,2026-02-20 10:40:00,What's Going On With Palantir Stock Friday?,Palantir Technologies Inc. (NASDAQ: PLTR) stock falls amid legal clash with Percepta and scrutiny over CEO&#39;s jet expenses.,Benzinga,-0.9997207522392273,negative,Finnhub
PLTR,Palantir Technologies Inc.,2026-02-19 20:53:32,Why One Expert Thinks Palantir's Slumping Stock Is an Opportunity for Investors,Palantir's recent slide has one analyst saying the shares are starting to look like a deal.,Yahoo,0.9994848966598511,positive,Finnhub
PLTR,Palantir Technologies Inc.,2026-02-19 18:55:03,Palantir Stock Just Got Cheaper – Will Buying The Recent Dip Pay Off?,"Palantir’s valuation remains high, but the recent decline has eased some concerns. Also, analysts’ sentiment toward PLTR stock has improved over the past month.",Yahoo,0.9999995231628418,positive,Finnhub
PLTR,Palantir Technologies Inc.,2026-02-19 18:21:34,Palantir Wins Partial Court Ruling in Percepta Dispute,Judge finds likely contract breaches but allows startup to continue operating,Yahoo,0.9987232089042664,positive,Finnhub
PLTR,Palantir Technologies Inc.,2026-02-19 17:24:00,Palantir Has a Vision of an AI-First World. Will It Make Investors Rich?,CEO Alex Karp has ambitious plans for the company he leads.,Yahoo,0.9999165534973145,positive,Finnhub
PLTR,Palantir Technologies Inc.,2026-02-19 17:10:35,Options Corner: Palantir Stock's Brutal Start Is Finally Showing Signs Of Improvement,"While Palantir has technically started the new year deep in red ink, the smart money&#39;s relaxed hedging may signal optimism for PLTR stock.",Benzinga,0.9997836947441101,positive,Finnhub
PLTR,Palantir Technologies Inc.,2026-02-19 14:52:32,Rackspace Stock Just Surged Into Overbought Territory. The Case for Still Buying RXT Now.,Rackspace stock soared on a new strategic partnership with Palantir. But is it worth buying RXT shares as their RSI climbs deeply into the overbought territory?,Yahoo,0.8578870296478271,positive,Finnhub
PLTR,Palantir Technologies Inc.,2026-02-19 13:31:00,Palantir vs. Microsoft Stock: Which Is Wall Street More Bullish On?,Both stocks have tumbled by double-digit percentages since the start of the year.,Yahoo,-0.9998704195022583,negative,Finnhub
PLTR,Palantir Technologies Inc.,2026-02-19 12:01:01,Michael Burry Sounds Alarm on Palantir -- Warns Shares Could Fall to $46,PLTR Investors Watch Closely as Burry Questions Valuation and Margins,Yahoo,-0.9919542670249939,negative,Finnhub
PLTR,Palantir Technologies Inc.,2026-02-19 11:31:00,Palantir Technologies Inc-A (NASDAQ:PLTR) Passes Key Growth Stock Screen,"Palantir stock aligns with a proven growth framework, showing strong earnings momentum, soaring revenue, and high profitability, though valuation remains a key consideration.",ChartMill,1.0,positive,Finnhub
PLTR,Palantir Technologies Inc.,2026-02-19 05:43:32,"Palantir Technologies Inc. (PLTR) Extends Airbus Deal, What It Means","Palantir Technologies Inc. (NASDAQ:PLTR) is among the most profitable software stocks to buy now. On February 10, Palantir Technologies Inc. (NASDAQ:PLTR) announced the extension of its multi-year agreement with Airbus to continue strengthening Skywise, a civil aviation data platform. While improving designs and efficiency of aircraft and equipment, the platform also enhances the performance of […]",Yahoo,1.0,positive,Finnhub
PLTR,Palantir Technologies Inc.,2026-02-19 04:39:41,What Options Say About Palantir For The Intermediate-Term (Technical Analysis),Palantir Technologies Inc. option stats indicate a rally setup with $70M in daily put buying signaling a contrarian turn. Read why I rate PLTR stock a buy.,SeekingAlpha,0.9999995231628418,positive,Finnhub
PLTR,Palantir Technologies Inc.,2026-02-18 23:58:07,Analysts revamp Palantir stock rating,"Palantir (PLTR) stock is up today, trading 5% higher near $140, at the time of writing, Wednesday, Feb. 18, according to Yahoo Finance. The stock lost about 32% since the release of the Q3 earnings report, despite it being strong, and the Q4 report, too, after reaching the peak closing price of ...",Yahoo,0.998988926410675,positive,Finnhub
PLTR,Palantir Technologies Inc.,2026-02-18 22:04:00,"Stock Market Today, Feb. 18: Palantir Technologies Rises After Mizuho Upgrade Highlights AI Growth Potential","Today, Feb. 18, 2026, investors weigh fresh analyst upgrades, new AI alliances, and a bold headquarters shift reshaping Palantir.",Yahoo,0.9880857467651367,positive,Finnhub
PLTR,Palantir Technologies Inc.,2026-02-18 18:30:02,"Has Palantir Bottomed? Probably, Based on Huge, Unusual Put Options Activity in PLTR","Palantir stock may have hit a bottom after several tranches of large, unusual volume in out-of-the-money PLTR put options traded today. Palantir's strong free cash flow and FCF margins imply a higher price target.",Yahoo,1.0,positive,Finnhub
PLTR,Palantir Technologies Inc.,2026-02-18 18:23:52,Palantir Stock Jumps on Analyst Upgrade -- Mizuho Calls It a 'Buying Opportunity',"Analysts Upgrade Palantir, Calling Valuation Pullback a Buying Opportunity",Yahoo,1.0,positive,Finnhub
PLTR,Palantir Technologies Inc.,2026-02-18 18:09:47,"Palantir, Rackspace Announce AI Partnership",New partnership targets faster AI rollouts,Yahoo,0.9527835249900818,positive,Finnhub
PLTR,Palantir Technologies Inc.,2026-02-18 17:25:58,Why Palantir Technologies (PLTR) Stock Is Trading Up Today,Shares of data analytics company Palantir Technologies (NASDAQ:PLTR) jumped 4.6% in the afternoon session after an analyst at Mizuho upgraded the stock's rating and the company announced a strategic partnership with Rackspace Technology.,Yahoo,0.9999905824661255,positive,Finnhub
PLTR,Palantir Technologies Inc.,2026-02-18 17:08:23,Stock Of The Day: Is Palantir Finally Reversing?,"Palantir stock rebounds off key support at $130, highlighting how remorse-driven buying and selling can turn old support and resistance levels into powerful signals for traders.",Benzinga,0.9999995231628418,positive,Finnhub
PLTR,Palantir Technologies Inc.,2026-02-18 17:00:42,Why Palantir Technologies Charged Higher on Wednesday,The artificial intelligence (AI) and data mining specialist is winning over Wall Street.,Yahoo,1.0,positive,Finnhub
PLTR,Palantir Technologies Inc.,2026-02-18 16:07:21,Airbus Deepens India Ties And AI Push With New Growth Drivers,India and France have advanced defense cooperation with the launch of an Airbus Tata joint venture to build India’s first private helicopter assembly line. Airbus has also agreed a multi year expansion of its partnership with Palantir to develop AI enabled aerospace solutions on the Skywise open data platform. These moves highlight Airbus’s push into localized production in India alongside a deeper focus on digital tools for manufacturing and operations. For investors tracking Airbus...,Yahoo,0.9999104738235474,positive,Finnhub
PLTR,Palantir Technologies Inc.,2026-02-18 14:50:19,"Palantir upgraded, Workday downgraded: Wall Street's top analyst calls","Palantir upgraded, Workday downgraded: Wall Street's top analyst calls",Yahoo,-0.7117754220962524,negative,Finnhub
PLTR,Palantir Technologies Inc.,2026-02-18 13:22:00,"Palantir Stock Upgraded to Buy. AI Heavyweight Is ‘In a Category of One,’ Says Analyst.",Mizuho raises its rating on Palantir Technologies to Overweight from Neutral with a $195 price target.,Yahoo,0.9999984502792358,positive,Finnhub
PLTR,Palantir Technologies Inc.,2026-02-18 13:19:00,Palantir Stock Upgraded to Buy. AI Heavyweight Is ‘In a Category of One.’,Palantir Stock Upgraded to Buy. AI Heavyweight Is ‘In a Category of One.’,MarketWatch,0.9939928650856018,positive,Finnhub
PLTR,Palantir Technologies Inc.,2026-02-18 13:18:22,"Here Are Wednesday’s Top Wall Street Analyst Research Calls: Cadence Design, Crox, Genuine Parts, Kratos Defense, Medtronic, Palantir, StubHub, Transocean, and More","Pre-Market Stock Futures: Futures are trading higher after a sluggish start to the holiday-shortened trading week. While stocks started as if it were going to be another risk-off day, they turned positive by late morning, and all the indices ended the day modestly higher. With a trove of economic data on the way, and fourth-quarter ... Here Are Wednesday’s Top Wall Street Analyst Research Calls: Cadence Design, Crox, Genuine Parts, Kratos Defense, Medtronic, Palantir, StubHub, Transocean, and Mo",Yahoo,0.9997804760932922,positive,Finnhub
PLTR,Palantir Technologies Inc.,2026-02-18 13:15:00,Rackspace and Palantir Partner to Run Foundry and AIP in Production with Governed Managed Operations,"Customers to gain accelerated AI-driven business outcomes from implementation expertise, cloud hosting, and data migration support in a governed operating modelSAN ANTONIO, Feb. 18, 2026 (GLOBE NEWSWIRE) -- Rackspace Technology® (NASDAQ: RXT), a hybrid multicloud and AI solutions company, and Palantir Technologies Inc. (NASDAQ: PLTR), a global leader in operational artificial intelligence platforms, today announced a strategic partnership to help enterprises rapidly deploy and operate Palantir’s",Yahoo,0.9962261915206909,positive,Finnhub
PLTR,Palantir Technologies Inc.,2026-02-18 13:05:02,Rackspace Soars on Palantir Deal: Will the Hail Mary Save the Stock?,Rackspace stock is soaring after announcing a deal with Palantir. Is it enough to save the struggling company?,Benzinga,0.8038322925567627,positive,Finnhub
PLTR,Palantir Technologies Inc.,2026-02-18 12:45:00,"These Stocks Are Today’s Movers: Nvidia, Palantir, Sandisk, Palo Alto, Analog Devices, Garmin, and More","Nvidia  rose 1.9%.  Facebook owner  Meta Platforms  is expanding its business with the chip designer in a deal likely to be worth tens of billions of dollars.  Meta will use millions of Nvidia’s Blackwell and Rubin graphics processing units, a reminder that Nvidia is still the leading player in artificial-intelligence processors.",Yahoo,0.9996342658996582,positive,Finnhub
PLTR,Palantir Technologies Inc.,2026-02-18 11:58:05,Palantir shares: ’Spectacular growth’ and valuation reset prompts Mizuho upgrade,"Investing.com -- Palantir was upgraded by Mizuho on Wednesday, with analysts citing a rare combination of rapid growth, accelerating momentum, and expanding margins.",Yahoo,0.9999998807907104,positive,Finnhub
POOL,Pool Corporation,2026-02-26 12:01:14,POOL CORP (NASDAQ:POOL) Offers a Dependable Dividend Supported by Strong Fundamentals,"POOL Corp offers a solid dividend yield backed by strong profitability and a reliable payment history, making it a candidate for long-term income investors.",ChartMill,1.0,positive,Finnhub
POOL,Pool Corporation,2026-02-26 09:38:55,5 Revealing Analyst Questions From Pool’s Q4 Earnings Call,"Pool’s fourth quarter results were met with a negative market reaction, as revenue remained flat year over year and fell short of Wall Street expectations. Management attributed the quarter’s performance to persistent weakness in new pool construction, with CEO Peter Arvan noting that industry-wide new pool builds continued to decline, while maintenance spending held up. In particular, difficult year-over-year comparisons in regions like Florida, which benefited from hurricane-related repairs la",Yahoo,-0.9999988079071045,negative,Finnhub
POOL,Pool Corporation,2026-02-25 13:34:00,Here’s Why Pool Corporation (POOL) Traded Lower in Q4,"The London Company, an investment management company, released its fourth-quarter 2025 investor letter for its “The London Company Mid Cap Strategy”. A copy of the letter can be downloaded here. In Q4 2025, US equities posted the third consecutive quarter of higher returns, with the Russell 3000 Index rising 2.4%. The market highlighted how investors […]",Yahoo,0.8732590675354004,positive,Finnhub
POOL,Pool Corporation,2026-02-23 11:28:03,"Stifel Maintains Hold on Pool, Lowers Price Target to $232",Stifel  analyst W. Andrew Carter   maintains Pool (NASDAQ:POOL) with a Hold and lowers the price target from $240 to $232.,Benzinga,-0.999962568283081,negative,Finnhub
POOL,Pool Corporation,2026-02-20 14:05:12,"Wells Fargo Maintains Equal-Weight on Pool, Lowers Price Target to $230",Wells Fargo  analyst Sam Reid   maintains Pool (NASDAQ:POOL) with a Equal-Weight and lowers the price target from $275 to $230.,Benzinga,-0.9997406601905823,negative,Finnhub
POOL,Pool Corporation,2026-02-20 13:19:56,"Baird Maintains Outperform on Pool, Lowers Price Target to $300",Baird  analyst David Manthey   maintains Pool (NASDAQ:POOL) with a Outperform and lowers the price target from $320 to $300.,Benzinga,-0.7941683530807495,negative,Finnhub
POOL,Pool Corporation,2026-02-20 12:31:39,Pool Corporation Stock: Analyst Estimates & Ratings,"Pool has markedly lagged the broader market over the past year, though analysts continue to express a constructive outlook on the company’s longer-term prospects.",Yahoo,1.0,positive,Finnhub
POOL,Pool Corporation,2026-02-20 12:15:30,Soft Demand Weighed on Pool Corp.’s (POOL) Shares,"Conestoga Capital Advisors, an asset management company, released its fourth-quarter 2025 investor letter. As many believe, US equities experienced solid returns in 2025, with double-digit gains across all major indices, yet underlying conditions revealed extreme volatility and market leadership. A copy of the letter can be downloaded here. In Q4 2025, Conestoga Capital Advisors SMid Cap Strategy […]",Yahoo,0.9954185485839844,positive,Finnhub
POOL,Pool Corporation,2026-02-20 05:32:38,POOL Q4 Deep Dive: Flat Sales and Cautious Guidance Amid Ongoing Market Pressure,"Swimming pool distributor Pool (NASDAQ:POOL) missed Wall Street’s revenue expectations in Q4 CY2025, with sales flat year on year at $982.2 million. Its GAAP profit of $0.85 per share was 12.1% below analysts’ consensus estimates.",Yahoo,-0.9999998807907104,negative,Finnhub
POOL,Pool Corporation,2026-02-19 23:02:54,Pool Corp (POOL) Q4 2025 Earnings Call Highlights: Navigating Challenges with Strategic Growth ...,"Despite a slight dip in quarterly sales, Pool Corp (POOL) showcases resilience with improved gross margins, increased shareholder distributions, and strategic expansions.",Yahoo,1.0,positive,Finnhub
POOL,Pool Corporation,2026-02-19 20:40:42,Why Pool (POOL) Shares Are Trading Lower Today,"Shares of swimming pool distributor Pool (NASDAQ:POOL) fell 13% in the afternoon session after it reported fourth-quarter 2025 earnings and revenue that missed analyst expectations and provided a weaker-than-anticipated forecast for 2026. Net sales for the quarter were flat year on year at $982.2 million, falling short of estimates. The company's profit also declined, with earnings per share (EPS) of $0.85, down from $0.98 in the same period the previous year and below forecasts. Looking ahead,",Yahoo,-0.9999994039535522,negative,Finnhub
POOL,Pool Corporation,2026-02-19 17:54:43,Pool Corp (POOL) Q4 2025 Earnings Call Transcript,"One important industry theme this year was the ongoing decline in general construction activity, including new pool construction.  It is important to note that this trend is not unique to our business but is felt across the broader construction sector.  While new pool construction remains down, maintenance spending proved resilient.",Yahoo,-0.9998551607131958,negative,Finnhub
POOL,Pool Corporation,2026-02-19 17:27:00,Pool Q4 Earnings Call Highlights,"Pool (NASDAQ:POOL) executives told investors the company navigated a challenging 2025 backdrop marked by shifting demand patterns, continued weakness in new pool construction, and pressure on discretionary spending, while leaning on resilient maintenance activity, pricing discipline, and ongoing inv",Yahoo,-0.9999971389770508,negative,Finnhub
POOL,Pool Corporation,2026-02-19 13:28:36,POOL CORP (NASDAQ:POOL) Shares Drop on Q4 Earnings and Revenue Miss,"POOL CORP shares drop after Q4 earnings miss estimates, with revenue and EPS falling short of Wall Street forecasts.",ChartMill,-0.9999996423721313,negative,Finnhub
POOL,Pool Corporation,2026-02-19 13:15:02,Pool Corp. (POOL) Lags Q4 Earnings and Revenue Estimates,"Pool Corp. (POOL) delivered earnings and revenue surprises of -15.15% and -1.61%, respectively, for the quarter ended December 2025. Do the numbers hold clues to what lies ahead for the stock?",Yahoo,-0.9375259280204773,negative,Finnhub
POOL,Pool Corporation,2026-02-19 12:21:35,"Pool (NASDAQ:POOL) Misses Q4 CY2025 Revenue Estimates, Stock Drops","Swimming pool distributor Pool (NASDAQ:POOL) fell short of the market’s revenue expectations in Q4 CY2025, with sales flat year on year at $982.2 million. Its GAAP profit of $0.85 per share was 12.2% below analysts’ consensus estimates.",Yahoo,-0.9999997615814209,negative,Finnhub
